index,claim,context,topic,author,labels
1393,Ngày 16-3-2023 Trung tâm Y tế quận 10 thông báo với Trung tâm Kiểm soát bệnh tật TP.HCM về số học sinh nghỉ ốm tăng bất thường tại Trường tiểu học Võ Trường Toản.,"Tối 22-3, Trung tâm Kiểm soát bệnh tật TP.HCM cho hay thành phố vừa phát hiện chùm ca bệnh H1N1 tại quận 10 khiến 20 học sinh tại một trường tiểu học nghỉ ốm bất thường. Tổ chức thăm khám, điều tra dịch tễ cho trẻ trong chùm ca bệnh H1N1 tại Trường tiểu học Võ Trường Toản, quận 10 - Ảnh: Trung tâm Kiểm soát bệnh tật Cụ thể, ngày 16-3, Trung tâm Kiểm soát bệnh tật TP.HCM đã nhận được tin báo của Trung tâm Y tế quận 10 về số học sinh nghỉ ốm tăng bất thường tại Trường tiểu học Võ Trường Toản. Ngay sau khi nhận thông tin, trung tâm này đã phối hợp với Bệnh viện Nhi đồng 1 và Trung tâm Y tế quận 10 điều tra dịch tễ, thăm khám. Trong hai ngày, từ 15 đến 16-3, số học sinh nghỉ học của trường tiểu học này đã tăng cao bất thường. Có tổng cộng 20 học sinh bị bệnh với các triệu chứng như: sốt, ho, đau họng, mệt mỏi, ói. Có những học sinh sốt đến 39 độ C. Qua thăm khám, các bác sĩ nhận định ban đầu nghi ngờ các trẻ mắc cúm và thực hiện lấy ngẫu nhiên 6 mẫu xét nghiệm cúm. Mẫu xét nghiệm được gửi về Viện Pasteur để phân lập. Đến ngày 17-3, kết quả cho thấy 6/6 mẫu xét nghiệm cho kết quả dương tính với cúm A (H1N1). Tính từ ngày 17-3 đến nay, lớp học chưa ghi nhận thêm trường hợp mới có triệu chứng. Trung tâm Kiểm soát bệnh tật cho biết thêm, theo số liệu giám sát trong những tháng đầu năm, TP đã ghi nhận các chùm ca bệnh hô hấp ở trường học tại quận Bình Thạnh và mới đây là quận 10. Các chùm ca bệnh đã được ghi nhận và xử lý sớm giúp hạn chế lây lan. Đặc biệt, TP.HCM vào mùa cao điểm của các bệnh đường hô hấp, dễ lây lan trong môi trường tập trung đông người. Các cơ sở giáo dục cần thực hiện quản lý học sinh bằng công tác điểm danh mỗi ngày. Nếu giáo viên phát hiện có học sinh bị bệnh truyền nhiễm hoặc hai trường hợp cùng có vấn đề sức khỏe trong cùng thời gian hoặc tăng học sinh nghỉ ốm bất thường, cần báo ngay cho trạm y tế và trung tâm y tế địa phương để có hướng xử lý kịp thời. Đồng thời, khi có trường hợp học sinh nghỉ nhiều ngày liên tiếp mà không rõ lý do, giáo viên chủ nhiệm và nhà trường phải chủ động liên hệ phụ huynh để xác định có phải bị bệnh truyền nhiễm. Bên cạnh đó, khi đã phát hiện có chùm ca bệnh tại trường, trường tiếp tục theo dõi tình hình học sinh nghỉ bệnh hoặc có triệu chứng mới hằng ngày (kể cả ngày nghỉ), cập nhật danh sách học sinh mắc bệnh theo triệu chứng, thời gian, lớp học và báo cáo về trạm y tế theo quy định. Đặc biệt, trạm y tế hỗ trợ nhân viên y tế trường học khám, khai thác triệu chứng, tiền sử ăn uống, sinh hoạt của học sinh và phối hợp với trung tâm y tế giám sát theo dõi tình hình dịch bệnh tại trường, báo cáo về Trung tâm Kiểm soát bệnh tật hằng ngày. Phụ huynh cần đưa con đi khám bệnh sớm khi có các triệu chứng nghi ngờ và phản hồi thông tin về nhà trường để quản lý, theo dõi. ""Phụ huynh nên chủ động cho con đi tiêm ngừa các bệnh đã có vắc xin như cúm, thủy đậu, quai bị. Tiêm vắc xin là biện pháp phòng ngừa hiệu quả nhất để làm giảm tỉ lệ mắc và tỉ lệ bệnh nặng do bệnh truyền nhiễm"", Trung tâm Kiểm soát bệnh tật nhấn mạnh.",Sức khỏe,Tuổi Trẻ,0
5657,"Vào đầu năm 2023 trước đó, bà Lê Thị Thảo đã tổ chức xây dãy 9 căn nhà liền kề không phép tại TP Hải Phòng.","(Dân trí) - Gia đình Chủ tịch UBND phường Lãm Hà (quận Kiến An, TP Hải Phòng) tổ chức xây dãy 9 căn nhà liền kề không phép, chưa tách thửa và chưa có giấy phép xây dựng theo quy định. Ngày 30/3, trao đổi với PV Dân trí, lãnh đạo UBND phường Quán Trữ (quận Kiến An, TP Hải Phòng) cho biết đã lập biên bản đối với bà Lê Thị Thảo (vợ ông Vũ Khắc Hiệp - Chủ tịch UBND phường Lãm Hà) liên quan việc xây dựng 9 căn nhà liền kề không phép xảy ra tại số 64 Trữ Khê, phường Quán Trữ. Ngoài ra, UBND phường Quán Trữ cũng đã gửi hồ sơ vụ việc đến UBND quận Kiến An, TP Hải Phòng để ra quyết định xử phạt vi phạm hành chính liên quan 9 căn nhà liền kề kể trên... vì không có giấy phép xây dựng theo quy định. Trước đó, đầu năm 2023, UBND phường Quán Trữ (Kiến An, Hải Phòng) phát hiện bà Lê Thị Thảo (SN 1969, vợ ông Vũ Khắc Hiệp) và người thân tổ chức khởi công xây dựng 9 căn nhà liền kề trên thửa đất của gia đình ở mặt phố Trữ Khê, nên kiểm tra. Dãy 9 căn nhà liền kề của gia đình Chủ tịch UBND phường Lãm Hà xây dựng không phép tại địa bàn phường Quán Trữ, quận Kiến An, TP Hải Phòng (Ảnh: Hoàng Hoàn). Qua rà soát, lực lượng chức năng xác định, công trình xây dựng này chưa được tách thửa, chưa được cấp phép xây dựng và các căn nhà liền kề được xây dựng chung tường, chung móng. Theo UBND phường Quán Trữ, dãy nhà ở liền kề được xây dựng trên thửa đất rộng gần 1.000m2 mặt phố Trữ Khê, thuộc sở hữu của gia đình ông Vũ Khắc Hiệp và bà Lê Thị Thảo. UBND phường Quán Trữ đã thông báo yêu cầu bà Thảo dừng thi công và hoàn thiện thủ tục cấp phép xây dựng. Tuy nhiên, bà Thảo không chấp hành, tiếp tục tổ chức thi công móng và xây dựng tầng một dãy nhà liền kề. 9 căn nhà ở liền kề bị đình chỉ xây dựng (Ảnh: Hoàng Hoàn). Đến giữa tháng 2/2023, UBND phường Quán Trữ tiếp tục kiểm tra phát hiện dãy nhà liền kề này vẫn có công nhân thi công tầng 2, phía ngoài công trình có dựng rào chắn, có bảo vệ ngăn lực lượng chức năng kiểm tra. Ngay sau đó, UBND phường Trữ Khê đã thông báo lần 2, lập biên bản vi phạm. Ngày 15/2, Thanh tra Sở Xây dựng TP Hải Phòng có công văn đề nghị UBND quận Kiến An chỉ đạo UBND phường Quán Trữ và các phòng ban chuyên môn thuộc quận kiểm tra, xác minh nguồn gốc đất, kiểm tra trật tự xây dựng, lập hồ sơ xử lý với 9 căn nhà liền kề nêu trên. Đồng thời, đề nghị quận Kiến An đình chỉ thi công xây dựng. Liên quan tới việc này, trao đổi thêm với phóng viên Dân trí, Chủ tịch UBND quận Kiến An Nguyễn Trường Sơn xác nhận sự việc vào cho biết, 9 căn nhà liền kề của gia đình ông Vũ Khắc Hiệp, Chủ tịch UBND phường Lãm Hà chưa có giấy phép xây dựng. Theo ông Sơn, gia đình ông Hiệp xây 9 căn nhà trên đất có sổ đỏ, do cha ông để lại. Ông Hiệp xây là để cho thuê chứ không phải mua bán, cái sai ở đây của gia đình ông Hiệp là công trình phải xin giấy phép xây dựng, thì hộ dân lại không làm. Để tìm hiểu thông tin về sự việc, phóng viên báo Dân trí đã liên hệ với ông Vũ Khắc Hiệp - Chủ tịch UBND phường Lãm Hà, tuy nhiên ông Hiệp cho biết đang bận họp và sẽ thông tin sự việc lại sau.",Xã hội,Dân Trí,0
1149,Chính phủ đề nghị xây dựng Luật CCCD với bốn nhóm chính sách nhằm hạn chế phát sinh thủ tục hành chính về dự án Luật CCCD và tháo gỡ khó khăn vướng mắc trong thi hành Luật CCCD năm 2014.,"(PLO)- Thường trực Ủy ban Pháp luật cho rằng các cơ quan tán thành với sự cần thiết sửa đổi Luật CCCD nhưng theo cơ quan thẩm tra, cần phải có giải pháp chặn nguy cơ lộ, lọt thông tin cá nhân. Sáng 17-3, tiếp tục phiên họp thứ 21, Ủy ban Thường vụ Quốc hội cho ý kiến về đề nghị bổ sung vào Chương trình xây dựng luật, pháp lệnh năm 2023 đối với dự án Luật CCCD (sửa đổi). Sửa luật nhằm hạn chế phát sinh thủ tục hành chính Về dự án Luật CCCD (sửa đổi), Bộ trưởng Bộ Tư pháp Lê Thành Long cho biết để tháo gỡ khó khăn, vướng mắc trong thi hành Luật CCCD năm 2014 và đáp ứng yêu cầu, nhiệm vụ liên quan đến ứng dụng cơ sở dữ liệu quốc gia về dân cư, phát huy giá trị, tiện ích CCCD, phục vụ phát triển ứng dụng dữ liệu về dân cư, định danh điện tử… Chính phủ đề nghị xây dựng Luật CCCD (sửa đổi) với bốn nhóm chính sách. Thứ nhất, quy định việc tích hợp thông tin khác ngoài thông tin trong cơ sở dữ liệu CCCD vào CCCD. CCCD có giá trị sử dụng để cung cấp thông tin về công dân và tương đương việc xuất trình các giấy tờ do cơ quan có thẩm quyền cấp có thông tin đã được in hoặc tích hợp trong CCCD. Thứ hai, bổ sung thông tin lưu trữ trong cơ sở dữ liệu quốc gia về dân cư và cơ sở dữ liệu CCCD. Thứ ba, bổ sung đối tượng được cấp CCCD và đối tượng được cấp giấy chứng nhận CCCD. Thứ tư, hoàn thiện quy định về quản lý, vận hành, khai thác, sử dụng thông tin trong cơ sở dữ liệu quốc gia về dân cư, cơ sở dữ liệu CCCD; tài khoản định danh điện tử (căn cước điện tử) và việc sử dụng tài khoản định danh điện tử; cấp, hủy, thu hồi số định danh cá nhân; quy định về việc sử dụng thống nhất CCCD và việc hạn chế phát sinh thủ tục hành chính có liên quan. Chính phủ đề nghị Ủy ban Thường vụ Quốc hội xem xét, trình Quốc hội bổ sung dự án Luật CCCD (sửa đổi) vào Chương trình xây dựng luật, pháp lệnh năm 2023, trình Quốc hội cho ý kiến tại kỳ họp thứ năm (tháng 5-2023) và thông qua tại kỳ họp thứ sáu (tháng 10-2023). Cần giải pháp chặn nguy cơ lộ, lọt thông tin cá nhân Thẩm tra nội dung này, Chủ nhiệm Ủy ban Pháp luật Hoàng Thanh Tùng cho biết các cơ quan tán thành với sự cần thiết sửa đổi Luật CCCD. Tuy nhiên, cơ quan thẩm tra đề nghị trong quá trình xây dựng dự án luật cần tiếp tục bổ sung đánh giá tác động kỹ hơn đối với các chính sách trong dự án luật, nhất là đánh giá về nguồn lực thực hiện (kinh phí từ ngân sách nhà nước và chi phí từ phía người dân), lộ trình thực hiện để bảo đảm tính khả thi. Ông Tùng đề nghị làm rõ phương thức thực hiện việc tích hợp thông tin vào CCCD, bổ sung thông tin vào cơ sở dữ liệu CCCD để không gây phiền hà cho người dân; rà soát các luật có liên quan bảo đảm sự đồng bộ, thống nhất. Với các chính sách cụ thể, Thường trực Ủy ban Pháp luật lưu ý việc đưa nhiều thông tin cá nhân vào CCCD dẫn đến tăng nguy cơ lộ, lọt thông tin cá nhân. Do đó, cơ quan thẩm tra đề nghị cần có giải pháp chỉ cấp quyền đọc thông tin tích hợp trong CCCD phù hợp với yêu cầu quản lý, giao dịch của công dân trong từng trường hợp cụ thể, bảo đảm bí mật đối với những thông tin không trực tiếp liên quan đến yêu cầu quản lý, giao dịch cụ thể đó. Do các thông tin được đề xuất tích hợp bổ sung vào CCCD đều là thông tin cá nhân, bí mật cần được bảo vệ (như BHXH, bảo hiểm y tế, tài khoản ngân hàng, lý lịch tư pháp…) gắn với quyền con người, quyền công dân, Thường trực Ủy ban Pháp luật đề nghị cơ quan soạn thảo tiếp tục nghiên cứu, đánh giá tác động kỹ lưỡng, thống nhất với các bộ, cơ quan quản lý ngành, lĩnh vực để đưa ra giải pháp phù hợp, có tính khả thi.• Liên quan đến đề xuất bổ sung quy định cấp CCCD cho trẻ em dưới 14 tuổi, tại phiên họp, Bộ trưởng Bộ Công an Tô Lâm giải thích thêm. Ông nói: Chúng ta kêu gọi xây dựng chính phủ điện tử thì các cháu cũng phải được giao dịch. Bây giờ đăng ký điện thoại, Sim điện thoại phải có căn cước, thế các cháu dưới 14 tuổi có được dùng điện thoại không, hay cha mẹ đăng ký để con dùng? Trẻ được tham gia các hoạt động trên môi trường mạng nhưng để tránh những bất cập, chúng ta phải hoàn thiện những vấn đề này. Bây giờ, trẻ mới sinh ra được cấp hộ chiếu ngay bởi vì đây là yêu cầu quốc tế. Tuy nhiên, ngoài hộ chiếu và giấy khai sinh, các cháu không có giấy tờ gì để giao dịch. Trẻ đi học phải dựa vào giấy khai sinh nhưng giấy này không chứng minh được người khai sinh là người giám hộ. Theo quy định, khi đi máy bay, trẻ phải có giấy khai sinh. Tuy nhiên, thực tế nhiều gia đình đối phó bằng cách khai mất giấy khai sinh, hoặc có trường hợp mượn giấy khai sinh của một cháu khác có thông tin tương thích… Rất nhiều bất cập liên quan chưa giải quyết được. CCCD hiện là một trong những phương thức quản lý dân cư hiện đại trên thế giới, chúng ta đang phấn đấu thống nhất các loại giấy tờ trong ASEAN, công dân các nước đi lại trong ASEAN không cần hộ chiếu. Nếu các quốc gia thống nhất, công dân Việt Nam có thể đi lại các nước ASEAN bằng CCCD, đây là vấn đề hội nhập nhưng đang có “khoảng trống” do công dân không có được giấy tờ để hội nhập quốc tế. Nếu triển khai việc cấp CCCD cho trẻ thì thời hạn sẽ không giống người lớn mà có thể năm năm phải đổi một lần. Bộ Công an đặt mục tiêu 100% nhân dân giao dịch được trên môi trường điện tử, 100% người dân có căn cước. Sau khi nêu hàng loạt lợi ích về việc cấp CCCD cho trẻ, ông nói: “Chúng tôi muốn làm càng sớm càng tốt, người dân ít giấy tờ cũng phục vụ cho quản lý xã hội, giao dịch xã hội một cách thông minh, tiện lợi nhất. Chúng ta không nên để lỡ cơ hội này trong quản lý, quản trị xã hội”.",Thời Sự,Báo Pháp Luật HCM,0
5875,"Nhà làm việc trên đỉnh Hòn Bà của bác sĩ Alexandre Yersin được xây dựng khoảng năm 1914 đã được Bộ Văn hóa, Thể thao và Du lịch quyết định bổ sung là di tích quốc gia.","Bộ Văn hóa, Thể thao và Du lịch vừa có quyết định bổ sung nhà làm việc của bác sĩ Alexandre Yersin trên đỉnh Hòn Bà là di tích quốc gia. Ngôi nhà gỗ trên đỉnh Hòn Bà của bác sĩ Alexandre Yersin được xếp hạng di tích quốc gia - Ảnh: HỘI ÁI MỘ BÁC SĨ YERSIN Nhà làm việc trên đỉnh Hòn Bà của bác sĩ Alexandre Yersin được xây dựng khoảng năm 1914. Theo bài viết của chính bác sĩ Alexandre Yersin đăng trên Tập san Hội Nghiên cứu Đông Dương, cách đây khoảng 109 năm (vào năm 1914), ông đã quan sát và tìm cách lên một đỉnh núi Hòn Bà ở độ cao khoảng 1.500m. Một cộng sự của Alexandre Yersin là ông Krempf đã hoàn thành nhiệm vụ. Yersin viết: ""Nhờ kỹ năng của một nhà leo núi xuất sắc, ông ấy (tức Krempf - PV) đã hoàn thành nhiệm vụ này, khi men theo sườn núi phía Bắc. Ông ấy là người đầu tiên lên đến đỉnh núi ở độ cao 1.500m. Đỉnh này được gọi là Hòn Bà"". Vẫn theo bài viết của Alexandre Yersin: ""Vào lúc đó, Viện hàn lâm Khoa học (Pháp) đã trao cho tôi một giải thưởng. Tôi liền dùng số tiền bất ngờ này để thuê những người Thượng thiết lập một con đường mòn khả thi, nối Suối Giao với Hòn Bà, thông qua Suối Cả, sẽ rốt cuộc cho phép thành lập trạm thử nghiệm"". Đó chính là trạm thử nghiệm của Alexandre Yersin ở độ cao 1.578m. Trạm thử nghiệm ấy gồm căn nhà gỗ hai tầng, có bể nước kiên cố, được Yersin dùng làm nơi ở khi làm việc, nghiên cứu trên đỉnh Hòn Bà. Tuy nhiên, sau đó khu vực này bị bỏ hoang, ngôi nhà chỉ còn lại nền móng. Năm 2005, Công ty CP Yasaka - Sài Gòn - Nha Trang được UBND tỉnh Khánh Hòa cho phép xây dựng lại căn nhà gỗ này trên nền móng cũ, ngôi nhà được xây dựng có kết cấu tương tự ngôi nhà cũ trước đây. Hiện nay, khu vực nhà làm việc này nằm trong Khu bảo tồn thiên nhiên Hòn Bà, do Ban quản lý Khu bảo tồn thiên nhiên Hòn Bà (thuộc Sở Nông nghiệp và Phát triển nông thôn tỉnh Khánh Hòa) quản lý. Cách đây gần 33 năm, Bộ Văn hóa, Thông tin, Thể thao và Du lịch đã có quyết định (số 993/QĐ - ngày 28-9-1990) xếp hạng quần thể ""di tích lịch sử lưu niệm nhà bác học Alexandre Yersin"" tại Khánh Hòa là di tích quốc gia. Quần thể di tích quốc gia này bao gồm: thư viện tại Viện Pasteur Nha Trang; ngôi mộ chôn cất theo di nguyện của Alexandre Yersin tại đồn điền Suối Dầu; chùa Linh Sơn (tại xã Suối Cát, gần khu vực mộ Yersin) - là một trong những nơi thờ A.Yersin từ sau khi ông mất đến nay. Đến tháng 2-2023, UBND tỉnh Khánh Hòa có tờ trình đề nghị Bộ Văn hóa, Thể thao và Du lịch bổ sung nhà làm việc của bác sĩ A.Yersin trên núi Hòn Bà là di tích quốc gia.",Văn hóa,Tuổi Trẻ,0
4128,"Sự kiện, hoạt động Năm Du lịch quốc gia 2023 sẽ được đẩy mạnh truyền thông trên các kênh truyền thông, triển lãm ảnh, ấn phẩm báo,...","(Chinhphu.vn) - Bộ VHTT&DL vừa ban hành kế hoạch truyền thông Năm Du lịch quốc gia 2023 - Bình Thuận với nội dung đẩy mạn truyền thông, quảng bá du lịch Việt Nam, du lịch Bình Thuận và Năm Du lịch quốc gia 2023 ở trong nước và nước ngoài. Logo Năm du lịch quốc gia 2023 (tiếng Việt và tiếng Anh) - Ảnh: svhttdl.binhthuan.gov.vn Về truyền thông, quảng bá trong nước, Bộ VHTT&DL cho biết sẽ giới thiệu sự kiện, hoạt động Năm Du lịch quốc gia 2023 trên các kênh truyền thông số; triển lãm ảnh giới thiệu văn hóa, du lịch Việt Nam tại Bình Thuận. Truyền thông sự kiện trên các ấn phẩm, báo, tạp chí, cổng thông tin điện tử... của Bộ VHTT&DL. Quảng bá sự kiện trên màn hình điện tử (LED) và biển quảng cáo tấm lớn (billboard) trên tuyến chính vào trung tâm TP. Phan Thiết (Bình Thuận) và các khu trọng điểm du lịch, khu vực tổ chức các hoạt động, sự kiện. Tổ chức Triển lãm ""Di sản Văn hóa biển, đảo Việt Nam""; tổ chức Festival nhiếp ảnh quốc tế Việt Nam. Bộ VHTT&DL cũng đề nghị các đại sứ quán/trung tâm văn hóa nước ngoài tại Việt Nam tổ chức các hoạt động VHTT&DL tại Bình Thuận chào mừng Năm Du lịch quốc gia 2023. Tổ chức đoàn phóng viên, báo chí trong nước khảo sát du lịch Bình Thuận để viết bài, phóng sự, quay phim... Truyền thông, quảng bá du lịch Bình Thuận và Năm Du lịch quốc gia 2023 tại các hội chợ du lịch trong nước… Một số hình ảnh về du lịch Bình Thuận (từ trái sang phải, từ trên xuống dưới): Đồi cát bay Mũi Né; bãi đá ""Ông Địa"", Phú Hài, Phan Thiết; Novaland Phan Thiết-khu vực tổ chức lễ khai mạc Năm Du lịch quốc gia 2023; cáp treo núi Tà Cú (huyện Hàm Thuận Nam); vịnh ""đá nhảy"" Thuận Quý (Hàm Thuận Nam) - Ảnh: Báo Bình Thuận Về truyền thông, quảng bá tại nước ngoài, bao gồm các hoạt động: Truyền thông, quảng bá du lịch Việt Nam, du lịch Bình Thuận và Năm Du lịch quốc gia 2023 tại các hội chợ du lịch quốc tế (ITB tại Đức, JATA tại Nhật và WTM tại Anh...). Truyền thông, quảng bá du lịch Việt Nam, du lịch Bình Thuận và Năm Du lịch quốc gia 2023 tại chương trình giới thiệu du lịch Việt Nam và các tuần văn hóa Việt Nam tại thị trường trọng điểm quốc tế (ASEAN, Đông Bắc Á, châu Âu, Ấn Độ, Australia, Mỹ...). Truyền thông, quảng bá du lịch Việt Nam, du lịch Bình Thuận và Năm Du lịch quốc gia 2023 trên các kênh truyền thông quốc tế và nền tảng mạng xã hội quốc tế; Tổ chức các đoàn phóng viên, báo chí quốc tế khảo sát du lịch Việt Nam và du lịch Bình Thuận để làm phim, viết phóng sự, đưa tin, viết bài... Kế hoạch cũng đặt ra yêu cầu bám sát chủ đề ""Năm Du lịch quốc gia 2023 - Bình Thuận - Hội tụ xanh"", đảm bảo hoạt động truyền thông, quảng bá truyền tải được thông điệp chủ đạo của sự kiện, tạo được sự lan tỏa rộng rãi đến du khách trong và ngoài nước. Các hoạt động truyền thông, quảng bá Năm Du lịch quốc gia 2023 phải thực hiện thường xuyên, liên tục, có trọng tâm, trọng điểm và được tổ chức với nhiều hình thức… Theo kế hoạch của Ban Tổ chức Năm Du lịch quốc gia 2023, lễ khai mạc Năm Du lịch quốc gia 2023 với chủ đề ""Bình Thuận–Hội tụ xanh"" tổ chức vào tối 25/3/2023. Năm Du lịch Quốc gia 2023 sẽ có hơn 200 sự kiện văn hóa, thể thao và du lịch với quy mô liên tỉnh, quốc gia và quốc tế được tổ chức trên địa bàn tỉnh Bình Thuận và tại 41 tỉnh/thành phố trong cả nước. BT",Văn hoá,Chính Phủ,0
