index,claim,context,topic,author,labels
6592,"Khi giao dịch cổ phiếu, nhà đầu tư lo sợ khi Ngân hàng Nhà nước dự kiến cho phép ngân hàng thương mại bán trái phiếu do doanh nghiệp đang gặp nhiều khó khăn.","(NLĐO) – Trong phiên giao dịch cổ phiếu hôm nay, 28-3, chỉ số VN-Index vẫn chưa bứt phá đi lên dù thị trường tiếp nhận không ít thông tin tích cực. Phiên giao dịch cổ phiếu hôm nay,28-3, chỉ số VN-Index tạm tạm dừng tại 1.054 điểm và chỉ tăng so với phiên giao dịch trước 2 điểm . Mở cửa giao dịch cổ phiếu, nhà đầu tư có phần phần lạc quan khi Ngân hàng Nhà nước dự kiến cho phép ngân hàng thương mại mua trái phiếu do doanh nghiệp phát hành để bổ sung vốn lưu động. Mặt khác, thông tin Chính phủ yêu cầu các bộ, ngành, chính quyền các tỉnh, thành phố rà soát các dự án bất động sản để cùng doanh nghiệp xử lý vướng mắc pháp lý, nhất là các dự án có phát hành trái phiếu doanh nghiệp…cũng tác động tích cực đến tâm lý nhà đầu tư chứng khoán. Kết quả, vào khoảng 14 giờ, chỉ số VN- Index đã tăng 7 điểm lên 1.059 điểm. Thế nhưng, tại thời điểm này, áp lực bán bất ngờ gia tăng khiến chỉ số này thu hẹp đà tăng điểm. Đóng cửa giao dịch, VN-Index tạm dừng tại 1.054 điểm và chỉ tăng so với phiên trước 2 điểm. Toàn sàn HoSE có 201 mã tăng và 185 mã giảm; khối lượng giao dịch đạt 648 triệu cổ phiếu, giá trị 11.207 tỉ đồng. Ngược lại, trên sàn Hà Nội, chỉ số HNX-Index giảm nhẹ gần 1 điểm còn 205 điểm. Sàn UpCom giảm 0,09 điểm còn 75,5 điểm. Nhận định phiên giao dịch cổ phiếu hôm nay, Công ty Chứng khoán Thành Công (TCSC) cho rằng dự thảo sửa đổi các quy định ngân hàng thương được mua trái phiếu sẽ giúp tháo gỡ khó khăn khi áp lực trái chủ yêu cầu tất toán trái phiếu trước hạn nhưng doanh nghiệp không có khả năng thực hiện; đồng thời tạo cơ chế giúp các ngân hàng quản lý dòng tiền, mục đích sử dụng vốn của doanh nghiệp…Từ đó, thị trường chứng khoán có thời điểm diễn biến tích cực. Tuy nhiên, những điểm thắt chặt của dự thảo nêu trên như ngân hàng thương không được mua trái phiếu khi doanh nghiệp có tỷ lệ nợ trên vốn chủ sở hữu hơn 5 lần, đồng thời việc cơ cấu lại nợ của doanh nghiệp không được dự thảo đề cập …khiến không ít nhà đầu tư chưa an tâm trong giao dịch cổ phiếu. Theo đó, chỉ số VN-Index trong 6 phiên giao dịch gần nhất chỉ tăng mỗi phiên vài điểm và chưa có dấu hiệu bứt phá đi lên.",Kinh tế,Người lao động,1
4914,Hoa hậu Thùy Tiên đã đăng ký hiến tạng sau khi đăng quang cuộc thi Miss Grand International.,"(NLĐO) - Hoa hậu Thùy Tiên đi đăng ký hiến tạng, giúp đỡ chi phí phẫu thuật cho bệnh nhân, đồng thời tiết lộ tập tành làm ca sĩ, tung cả MV. Hoa hậu Thùy Tiên đăng ký hiến tạng Mới đây, hoa hậu Thùy Tiên đã cho ra mắt series mới mang tên ""Những điều nhỏ xíu"" trên kênh TikTok riêng. Tại series này, nàng hậu sinh năm 1998 cho biết sẽ đến tìm hiểu, giúp đỡ, quyên góp tại các tổ chức có nhiều hoàn cảnh khó khăn. Thông qua đó, cô cũng muốn bản thân đóng vai trò là người truyền tải thông tin, hướng dẫn cách thức thực hiện và kêu gọi mọi người cùng chung tay thực hiện những hành động nhỏ để lan tỏa mạnh mẽ những giá trị tích cực. Trong series này, cô tiết lộ về hành trình đưa ê-kíp của mình đi đăng ký hiến tạng. Thùy Tiên chia sẻ rằng có nhiều cách đăng ký hiến tạng song cô quyết định đến bệnh viện ở chùa Giác Ngộ vì đây là nơi cô từng đăng ký. Trước khi đăng quang tại Miss Grand International, người đẹp 9x đã đăng ký hiến tạng và hành động can đảm này của cô đã nhận được nhiều lời khen từ công chúng. Cô cũng lấn sân ca sĩ khi ra mắt cả MV Thùy Tiên cũng nhấn mạnh thông điệp muốn mang lại trong series này: ""Một hành động tử tế dù lớn hay nhỏ sẽ không bao giờ là lãng phí. Hãy cùng Tiên làm Những điều nhỏ xíu"". Với sự lan tỏa tích cực mang lại, nàng hậu tiếp tục phát triển dự án này để tiếp cận nhiều tổ chức và kêu gọi cộng đồng cùng thực hiện ""Những điều nhỏ xíu"". Gần đây, Thùy Tiên cũng khiến đông đảo fan sắc đẹp ""ngỡ ngàng"" khi công bố poster và teaser MV của mình mang tên ""Be A Girl"", được ấn định ra mắt lúc 19 giờ ngày 23-2. Đây là ca khúc chủ đề của series thực tế ""Đu Đêm"", do chính cô trình bày. Dù không phải sở trường thế nhưng trong lần ra mắt ca khúc đầu tiên, Thùy Tiên còn ""chơi lớn"" khi thử sức với những phần rap cá tính. Để thực hiện ca khúc này, Thùy Tinh không chỉ tập hát, rap mà còn dành thời gian để luyện khả năng vũ đạo. Thùy Tiên đưa ê-kip đi đăng ký hiến tạng ""Đu Đêm"" cũng đang là một trong những dự án được thực hiện bởi hoa hậu Thùy Tiên. Tại series thực tế này, cô sẽ tạm thoát hình ảnh Hoa hậu để thử sức với nhiều công việc khác nhau như drag queen, bán rau, bán đồ ăn vặt, lái xe công nghệ và cả quét rác. Qua chương trình này, Thùy Tiên mang đến cho nhiều khán giả có góc nhìn rộng hơn về một Sài Gòn về đêm – khi rất nhiều người vẫn miệt mài làm việc mưu sinh.",Giải Trí,Người lao động,1
5384,"Với quy mô đầu tư dự kiến lên tới 100.000 ôtô và 100.000 xe máy, GSM sẽ chính thức đưa vào vận hành dịch vụ taxi điện và cho thuê ôtô, xe máy điện VinFast ngay trong tháng 4/2023.","(NLĐO) - Theo công bố của công ty GSM, taxi điện VinFast sẽ bắt đầu hoạt động từ tháng 4-2023 tại Hà Nội Ngày 23-3, đoàn taxi điện VinFast VF e34 khoảng 50 chiếc xuất phát từ nhà máy ôtô VinFast Hải Phòng di chuyển về Hà Nội đã thu hút sự chú ý của cộng đồng. Taxi điện VinFast VF e34 được sơn màu xanh, tượng trưng cho phương tiện xanh, thân thiện với môi trường. Đích đến của những chiếc taxi điện VinFast này là Công ty CP Di chuyển Xanh và Thông minh GSM của Chủ tịch Tập đoàn Vingroup Phạm Nhật Vượng tại Hà Nội. Công ty này chuyên cung cấp dịch vụ cho thuê ôtô, xe máy điện và dịch vụ taxi VinFast, dự kiến sẽ bắt đầu vào vận hành trong tháng 4 tới. Taxi điện VinFast VF e34 GSM có vốn điều lệ 3.000 tỉ đồng, do Chủ tịch Tập đoàn Vingroup Phạm Nhật Vượng thành lập và nắm 95% cổ phần. GSM hoạt động trong 2 mảng chính: cho thuê ôtô - xe máy điện và taxi điện. Taxi điện VinFast VFe34 di chuyển trên đường từ Hải Phòng về Hà Nội ngày 23-3 GSM sẽ cho các hãng dịch vụ vận chuyển như taxi, xe ôm công nghệ và nhân viên của họ thuê ôtô - xe máy điện để chở khách. GSM cũng tự vận hành dịch vụ taxi bằng ôtô điện VinFast. Theo kế hoạch, hãng taxi thuần ôtô điện đầu tiên tại Việt Nam do GSM thành lập sẽ đi vào hoạt động ngay trong tháng tới tại Hà Nội, tiến tới phủ sóng toàn quốc trong năm 2023. Trước đó ngày 21-3, GSM và Be Group - công ty công nghệ Việt Nam sở hữu nền tảng tiêu dùng đa dịch vụ ""be"" - đã ký kết thoả thuận hợp tác đầu tư, nhằm đưa ôtô điện và xe máy điện vào hoạt động dịch vụ vận tải đầu tiên tại Việt Nam. Đoàn xe nối đuôi di chuyển trên đường Theo thoả thuận hợp tác, GSM sẽ đầu tư trực tiếp vào Be Group để hỗ trợ đối tác hướng đến mục tiêu trở thành nền tảng tiêu dùng đa dịch vụ, cũng như cung cấp dịch vụ vận chuyển công nghệ hàng đầu Việt Nam. Ngoài ra, thông qua các đối tác tài chính, GSM sẽ hỗ trợ tài xế của Be Group chuyển đổi từ xe chạy xăng sang xe điện một cách thuận tiện và dễ dàng với chi phí vận hành tiết kiệm. Trong giai đoạn đầu, GSM sẽ phối hợp với Ngân hàng TMCP Việt Nam Thịnh Vượng (VPBank) cung cấp các chính sách ưu đãi độc quyền cho tài xế của Be Group để thuê hoặc mua ôtô, xe máy điện VinFast thông qua GSM với chi phí hấp dẫn. Trong lĩnh vực kinh doanh dịch vụ taxi công nghệ, GSM và Be Group cũng sẽ hợp tác chia sẻ nền tảng gọi xe. Theo đó, khách hàng gọi xe thông qua ứng dụng của Be Group có thể lựa chọn dịch vụ taxi điện của GSM, bên cạnh các dịch vụ beCar và beTaxi hiện có. Theo kế hoạch, GSM sẽ chính thức đưa vào vận hành dịch vụ taxi điện và cho thuê ôtô, xe máy điện VinFast ngay trong tháng 4 tới, với quy mô đầu tư dự kiến lên tới 10.000 ôtô và 100.000 xe máy. Cùng với các tài xế Be Group chuyển đổi sang sử dụng ôtô và xe máy điện, dịch vụ vận chuyển bằng phương tiện giao thông xanh hứa hẹn sẽ nhanh chóng bùng nổ tại Việt Nam trong thời gian tới. Tuần trước, GSM cũng hé lộ về bảng giá dịch vụ cho thuê đối với 3 mẫu ôtô điện VinFast VF e34, VinFast VF5 và VinFast VF8 Eco. Theo đó, VinFast VF e34 giá cho thuê là 11 triệu đồng/tháng, giá thuê pin theo tháng là 3,16 triệu đồng, số km tối đa là 2.500 km, đơn giá của 1 km phụ trội 1,265 đồng/km. Với VinFast VF5, mức giá cho thuê 9,5 triệu đồng/tháng, giá thuê pin 2,7 triệu đồng/tháng, số km tối đa là 2.500 km, đơn giá của 1 km phụ trội 1,082 đồng/km. Với VinFast VF8 Eco, mức giá cho thuê 20 triệu đồng/tháng, giá thuê pin 4,64 triệu đồng/tháng, số km tối đa là 2.500 km, đơn giá của 1 km phụ trội 1,850 đồng/km.",Kinh tế,Người lao động,1
5866,"Sau khi CLB Lâm Đồng không thể hoàn thành chuyển giao với CLB Sài Gòn để thi đấu tại giải hạng Nhất toàn quốc năm 2022, một số cầu thủ ở đây cho biết đội chưa hoàn thiện hợp đồng cũng như trả lương cho cầu thủ, các cầu thủ phải tự tức tập luyện.","(NLĐO) - Theo chia sẻ của một số cầu thủ CLB Lâm Đồng cho biết đội chưa hoàn tất hợp đồng với các cầu thủ, không trả lương, cầu thủ phải tự túc tập luyện. Sau khi CLB Lâm Đồng không thể hoàn tất chuyển giao với CLB Sài Gòn để thi đấu tại giải hạng Nhất quốc gia 2023. Theo đó, ""Cơn lốc cao nguyên"" phải trở về thi đấu tại giải hạng Nhì quốc gia và có ý định mượn lực lượng U21 Hà Nội để thi đấu khi kế hoạch thăng hạng diễn ra từ tháng 12-2022 thất bại. Trước những vấn đề trên, HLV Issawa Singthong và một số cầu thủ đã chia tay đội bóng. Bóng đá Lâm Đồng khó khăn trước thềm mùa giải hạng Nhì quốc gia 2023 Đến thời điểm hiện tại, lứa cầu thủ gia nhập đội vào tháng 12-2022 còn khoảng 10 cầu thủ được Sở Văn hóa Thể thao và Du lịch tỉnh Lâm Đồng giữ chân để thi đấu tại giải hạng Nhì quốc gia. Dù vậy, lứa cầu thủ này mới đây đã chia sẻ vẫn chưa thể ký hợp đồng, chưa nhận được tiền lương và phải ăn tập tự túc. Một số cầu thủ cho biết muốn được về quê nhưng không còn tiền để về. Đến thời điểm hiện tại CLB Lâm Đồng chỉ còn khoảng 11 ngày để hoàn tất đăng ký tư cách cầu thủ tham gia giải. Với những thông tin trên, ông Nguyễn Văn Tuyển - Giám đốc Trung tâm thể thao tỉnh Lâm Đồng cho biết: ""Hiện tại không phải không đăng ký các cầu thủ này dự giải, nhưng việc ký hợp đồng theo lương nhà nước không đáp ứng được nhu cầu hiện tại của các cầu thủ khiến đôi bên chưa thể thống nhất hợp đồng. Về vấn đề ăn tập tự túc, do chưa ký hợp đồng theo quy định nhà nước nên không thể giải quyết được"". Theo ông Tuyển, mức lương với các cầu thủ chỉ có cải thiện khi nhà đầu tư hoàn tất thủ tục và bàn giao tài trợ cho đội. Giám đốc Trung tâm thể thao tỉnh Lâm Đồng cho biết hiện tại chỉ còn tập đoàn Phương Trang tài trợ cho đội. Dù thỏa thuận đôi bên đã hoàn tất nhưng hợp đồng vẫn chưa được ký kết khiến đội gặp khó khăn. Thêm về vấn đề đăng ký cầu thủ, ông Nguyễn Văn Tuyển cho biết nếu thiếu vận động viên sẽ đôn cầu thủ đội U19 Lâm Đồng đang thi đấu giải U19 quốc gia lên thi đấu. Ngoài những vấn đề trên, CLB Lâm Đồng được cho là không có HLV chỉ đạo, phải tập chay sau khi chiến lược gia người Thái Lan chia tay đội. ""Thông tin này là chưa chính xác, bóng đá Lâm Đông vẫn còn có 2 cựu cầu thủ nổi tiếng là Đoàn Quốc Việt và Nguyễn Mạnh Quý có thế dẫn dắt đội"" - ông Tuyển khẳng định. Giải hạng Nhì quốc gia 2023 sẽ bắt đầu khởi tranh vào ngày 25-4 với sự tham gia của 14 đội bóng. Ở mùa giải năm nay, CLB Đắk Lắk, Dugong Kiên Giang và Luxury Hạ Long là những đội bóng vừa thăng hạng sau mùa giải năm ngoái..",Thể thao,Người lao động,1
3726,Cô đồng online Trương Hương bị xử phạt hơn 20 triệu đồng vì công khai ủng hộ mê tín dị đoan.,"(NLĐO) - Đại diện cơ quan chức năng của Bộ Thông tin và Truyền thông cho biết trong trường hợp vi phạm, cô đồng bổ cau ""đúng nhận, sai cãi"" phải gỡ video Trả lời Báo Người Lao Động, ông Nguyễn Phan Phúc, Phó Trưởng Phòng Thanh tra Báo chí và Xuất bản, Thanh tra Bộ Thông tin và Truyền thông (TT-TT) cho biết đơn vị này đã nắm được thông tin về video clip của cô đồng T.H với câu nói ""đúng nhận, sai cãi"" thu hút sự quan tâm trên các nền tảng mạng xã hội. ""Chúng tôi đang xem xét, thu thập tài liệu liên quan. Nếu phát hiện sai phạm sẽ xử lý"" - ông Phúc nói. Theo ông Nguyễn Phan Phúc, cơ quan chức năng của Bộ TT-TT đang xem xét các video có vi phạm đưa tin sai sự thật, truyền bá mê tín dị đoan, xúc phạm nhân phẩm người khác hay không. Khi đủ căn cứ kết luận vi phạm quy định pháp luật, Bộ TT-TT sẽ chỉ đạo các sở TT-TT có liên quan tham gia xử lý. ""Trong trường hợp vi phạm, chủ kênh T.H phải chủ động gỡ video. Nếu chủ kênh không gỡ video, đơn vị của Bộ TT-TT sẽ phối hợp với các nền tảng xuyên biên giới hạ video xuống. Ngoài ra, cơ quan chức năng vẫn có biện pháp kỹ thuật nhằm ngăn chặn video vi phạm"" - ông Nguyễn Phan Phúc nhấn mạnh. Cô đồng Trương Thị H. làm việc tại cơ quan Công an. Ảnh: CAND Trước đó, trên nền tảng TikTok, bà Trương Thị H. (SN 1986, trú tại phường Hiến Thành, thị xã Kinh Môn, tỉnh Hải Dương) tự xưng là cô đồng T.H phát đi nhiều video bói toán. Đáng chú ý, trong clip, người này vừa bổ cau vừa nói về các lá số tử vi và thường kết thúc với câu ""đúng nhận, sai cãi"" đã trở thành hot trend. Hệ quả là trên các nền tảng mạng xã hội có rất nhiều thông tin, dòng trạng thái, video ngắn… được đăng tải trên mạng xã hội đều được gắn theo kèm cụm từ ""đúng nhận, sai cãi"". Cụm từ ""đúng nhận, sai cãi"" xuất phát từ câu cửa miệng của cô đồng online Trương Thị H. thường xem bói bằng cách bổ cau. Sau mỗi lần ""phán"" gia cảnh hay chuyện quá khứ của người đến xem bói, cô đồng T.H. luôn có câu ""đúng nhận, sai cãi"", ""đúng nhận, sai cãi cho tôi"" . Không chỉ xem số mệnh, dự đoán về công việc, tình duyên, người phụ nữ này còn nói về gia thế, thậm chí chỉ đích danh họ tên các thành viên trong gia đình của người hỏi. Chỉ mới 2 tháng sau khi đăng clip đầu tiên, tài khoản TikTok của cô đồng T.H. đã có hơn 150.000 lượt theo dõi. Trước sự việc này, Công an tỉnh Hải Dương, Công an thị xã Kinh Môn đã nhanh chóng vào cuộc. Qua rà soát, đã xác định tài khoản Facebook ""Trương Hương"" là tài khoản Facebook cá nhân của Trương Thị H.. Quá trình làm việc, bà Trương Thị H. đã thừa nhận toàn bộ hành vi vi phạm của mình. Đồng thời, bà H. cho biết việc quay phát các video có nội dung xem bói như trên đều do một mình làm. Công an thị xã Kinh Môn đã tiến hành lập biên bản vụ việc, biên bản vi phạm hành chính, biên bản xác minh tình tiết của vụ việc vi phạm hành chính đối với bà Trương Thị H.. Theo lãnh đạo Công an thị xã Kinh Môn, hành vi của bà Trương Thị H. đã vi phạm vào Điểm b, Khoản 1, Điều 101, Nghị định 15/2020/NĐ-CP ngày 3-2-2020 của Chính phủ, sửa đổi, bổ sung tại Nghị định số 14/2022/NĐ-CP ngày 27-1-2022 của Chính phủ Quy định xử phạt vi phạm hành chính trong lĩnh vực bưu chính, viễn thông, tần số vô tuyến điện, công nghệ thông tin, an toàn thông tin mạng và giao dịch điện tử. Ngày 9-2, Công an thị xã Kinh Môn đã ra quyết định xử phạt vi phạm hành chính về hành vi ""Cung cấp, chia sẻ thông tin cổ súy các hủ tục, mê tín, dị đoan, dâm ô, đồi trụy không phù hợp với thuần phong, mỹ tục của dân tộc"" theo Điểm b, Khoản 1, Điều 101, Nghị định 15/2020/NĐ-CP sửa đổi bằng 14/2022/NĐ-CP bằng hình thức phạt tiền, với mức phạt là 7,5 triệu đồng. Cùng với đó, cơ quan chức năng đã yêu cầu bà Trương Thị H. buộc gỡ bỏ thông tin vi phạm.",Công nghệ,Người lao động,1
2747,"Khi khủng hoảng diễn ra, một nhà quản lý của Mỹ đã tiếp quản quyền kiểm soát SVB và lập ra nhà băng mới vì giá cổ phiểu tụt dốc.","Ngân hàng First Citizens của Mỹ đã đồng ý mua lại Ngân hàng Thung lũng Silicon (SVB), nhà băng vừa đổ sập trong tháng này gây ra cuộc khủng hoảng lan rộng. SVB là đối tác chính của giới khởi nghiệp công nghệ tại Mỹ, hoạt động từ thập niên 1980. Đây là ngân hàng lớn nhất tại Mỹ bị sụp đổ từ cuộc khủng hoảng tài chính toàn cầu năm 2008. Sau khi khách hàng đột ngột rút tiền khiến giá cổ phiếu lao dốc, các nhà quản lý của Mỹ đã quyết định tiếp quản quyền kiểm soát SVB và lập ra nhà băng mới gọi là Ngân hàng cầu nối Thung lũng Silicon (SVBB) để điều hành trong lúc tìm nhà đầu tư mua lại. Chi nhánh SVB tại Santa Monica, bang California AFP AFP dẫn thông báo ngày 27.3 của First Citizens cho biết đã đồng ý mua toàn bộ các khoản vay và một số tài sản khác của SVB, tiếp quản việc quản lý toàn bộ tiền gửi của khách hàng và một số nghĩa vụ khác. Tập đoàn Bảo hiểm tiền gửi liên bang Mỹ (FDIC), tổ chức độc lập của chính quyền đã tiếp quản SVB, cho biết giao dịch liên quan 119 tỉ USD tiền gửi và 72 tỉ USD tài sản. Khách hàng gửi tiền của SVB sẽ tự động trở thành khách hàng của First Citizens và 17 chi nhánh của SVB sẽ mở cửa trong ngày 27.3 vẫn dưới cái tên Ngân hàng Thung lũng Silicon nhưng là một đơn vị của Ngân hàng First Citizens. SVB, ngân hàng số một cho nhiều start-up Mỹ, đã phá sản trong 48 giờ ra sao? First Citizens nói rằng giao dịch được thực hiện nhằm đảm bảo vị thế tài chính vững chắc của ngân hàng và đảm bảo công ty sau khi sáp nhập vẫn có khả năng chống chịu với danh mục cho vay và cơ sở tiền gửi đa dạng. Ngoài FDIC, Bộ Tài chính và Cục Dự trữ liên bang Mỹ (Fed) đã vạch kế hoạch đảm bảo khách hàng của SVB có thể rút tiền nếu muốn, đồng thời thiết kế công cụ cho vay mới cho các ngân hàng nhằm ngăn chặn lặp lại tình trạng như SVB. Cuộc khủng hoảng của SVB đã gây mất niềm tin của khách hàng đối với các ngân hàng có quy mô tương tự, dẫn đến làn sóng rút tiền ồ ạt và gửi vào các nhà băng lớn được cho là an toàn hơn. Khủng hoảng cũng lan rộng sang châu Âu và góp phần khiến Ngân hàng Credit Suisse lớn thứ hai của Thụy Sĩ bị đối thủ UBS thâu tóm. Gần nhất, cổ phiếu của Deutsche Bank (Đức) cũng giảm giá mạnh trong ngày 24..3 khi chi phí bảo hiểm vỡ nợ của nhà băng này tăng cao, gây nỗi lo về một cuộc khủng hoảng rộng hơn trong ngành ngân hàng.",Thế giới,Thanh Niên,1
4149,"Nữ tỉ phú Madam Pang đã tăng tiền thưởng lên đến 2 triệu bath nếu đội nhà thắng UAE, và thật sự đội nhà đã thắng.","Theo báo chí Thái Lan, nữ tỉ phú Madam Pang (Nuanphan Lamsam), trưởng đoàn đội tuyển Thái Lan, tăng tiền thưởng lên đến 2 triệu baht (hơn 1,3 tỉ đồng) cho đội nhà nếu thắng UAE sáng 29.3. Tuy nhiên đội đã thua. Trận đấu giao hữu với đội tuyển UAE là trận thứ 2 của đội tuyển Thái Lan sau trận gặp đội tuyển Syria trong dịp FIFA Days cuối tháng 3. Đội tuyển Thái Lan (trái) thi đấu kém hiệu quả trước UAE FAT ""Cả 2 trận đấu này, đội tuyển Thái Lan đều thất bại khá dễ dàng"", theo tờ Siamsport. Ở trận đầu gặp đội tuyển Syria, các ""Voi chiến"" thua với tỷ số 1-3 (bàn duy nhất của Thái Lan do Suphanat Mueanta ghi). Trận này, Madam Pang cũng hứa thưởng đến 1,2 triệu baht (gần 1 tỉ đồng). Trận còn lại rạng sáng 29.3, đội tuyển Thái Lan nhận tiếp trận thua đội tuyển UAE tỷ số 0-2. HLV Mano Polking tiếp tục sử dụng những ngôi sao tốt nhất của đội tuyển Thái Lan như đội trưởng Chanathip Songkrasin, các tiền đạo Supachok Sarachat, Suphanat Mueanta và trung phong Supachai Chaided trong đội hình xuất phát. Tuy nhiên, đội tuyển Thái Lan chỉ chơi tốt ở khoảng thời gian đầu trận. Nhưng các cơ hội tạo ra đều không mang lại hiệu quả để có thể ghi bàn mở tỷ số. Vào hiệp 2, lối chơi hiệu quả của đội tuyển UAE phát huy tác dụng đã giúp họ có bàn mở tỷ số 1-0 do công Harib Abdalla ghi phút 55, trước khi ấn định chiến thắng 2-0 ở phút 79 do công Abdusalam Mohammed ghi. Lần lượt nhận 2 bàn thua, đội tuyển Thái Lan nỗ lực tìm bàn rút ngắn cách biệt, nhưng với lối chơi tấn công kém hiệu quả của đội quân HLV Mano Polking khiến họ để trôi qua các cơ hội. Với 2 trận thua trong dịp giao hữu FIFA Days cuối tháng 3, đội tuyển Thái Lan để lại nhiều thất vọng và sẽ bị rớt hạng trên bảng xếp hạng FIFA trong thời gian tới đây. Cùng với thất bại của đội tuyển Thái Lan, đội U.23 Thái Lan cũng thua trận cuối - trận tranh hạng 3 ở giải giao hữu Doha Cup 2023 trước đội U.23 Kuwait với tỷ số 0-1, vào rạng sáng 29.3.",Thể thao,Thanh Niên,1
