index,claim,context,topic,author,labels
1625,"ICAO công bố dự báo trên song truyền hình VTV ngày 8/2/2023 dự báo về sự phục hồi và tăng trưởng hoàn toàn, bền vững của nhu cầu hành khách hàng không năm 2023.","Muốn cho con khởi đầu vững chắc cả về kiến thức và kỹ năng, ngày càng nhiều gia đình Việt mong muốn đầu tư cho con học tập trong môi trường giáo dục quốc tế. Tuy nhiên, rào cản học phí khiến nhiều giấc mơ nhưng chưa thể thực hiện. Trên diễn đàn online, một người mẹ tâm sự và xin tư vấn về việc nên cho con học trường quốc tế từ bây giờ, hay nên đợi tới khi gia đình có thể thu xếp tài chính ổn định để đảm bảo cho con học tập xuyên suốt 12 năm, hoặc ít nhất là trong 1 cấp học? Lý do chị muốn cho con học ở môi trường giáo dục quốc tế ngay từ nhỏ bởi đây là giai đoạn có thể định hình nhân cách và ""xây nền móng"" cho trẻ, không chỉ về kiến thức, phương pháp học tập mà trên hết đó là các kỹ năng cần thiết để đáp ứng xu thế hội nhập và phát triển không ngừng của xã hội. ""Mình không cần con đạt được thành tựu lớn lao trong học tập, nhưng mình muốn con được bắt đầu với một nền giáo dục tiên tiến, phương pháp dạy và học hiện đại, để con được cập nhật những kiến thức mới nhất và nền tảng nhất. Từ đó, con có thể tự tin học tập ở các bậc học cao hơn, tự do phát triển bản thân theo cách con muốn mà không lo bị ""lạc hậu"" trong tương lai"", chị chia sẻ. Cho con học tập trong môi trường giáo dục quốc tế ngay từ bước khởi đầu để được trang bị nền tảng vững chắc về kiến thức và kỹ năng là ước mơ của ngày càng nhiều gia đình Việt Điều chị băn khoăn cũng là tâm sự chung của rất nhiều gia đình hiện nay. Nhiều phụ huynh chia sẻ họ muốn đầu tư cho con học trường quốc tế nhưng chưa dám quyết định vì lo lắng những thay đổi trong kế hoạch tài chính của gia đình trong tương lai. Điều đó có thể làm con đường học tập của con ""gãy gánh giữa đường"" và sẽ khó khăn khi chuyển sang một môi trường khác. Có thể thấy, rào cản học phí khiến cho ước mơ của nhiều phụ huynh và học sinh đang bị chậm trễ. Có gia đình vì ""đợi đủ nguồn tài chính"" nên đã bỏ lỡ mất giai đoạn phát triển tốt nhất của trẻ. Cũng có nhiều gia đình vẫn quyết định cho con học trường quốc tế từ sớm dù ba mẹ phải chấp nhận áp lực tài chính nhiều hơn, với mong ước cho con môi trường phát triển tốt nhất. Gần 20 năm kinh nghiệm triển khai dạy và học chương trình quốc tế tại Việt Nam, Trường Quốc tế Việt Úc (VAS) hiện là ngôi trường song ngữ quốc tế top đầu tại Việt Nam về bề dày lịch sử, kinh nghiệm, và đặc biệt là những thành tựu đạt được trong giảng dạy Chương trình Giáo dục Phổ thông Quốc tế Cambridge, cũng như Chương trình Giáo dục Quốc gia Việt Nam. Với số lượng hơn 8.000 học sinh theo học tại các cơ sở rộng khắp tại TP.HCM, VAS đang là lựa chọn của hàng chục ngàn phụ huynh mỗi năm. Và có lẽ, đây cũng là ngôi trường quốc tế hiếm hoi tại Việt Nam có học sinh là ""hai thế hệ"" trong một gia đình cùng theo học. Chị Huỳnh Mai Mỹ Huệ - một cựu học sinh của VAS, hiện có 2 con cũng đang là học sinh của VAS, chia sẻ: ""Những gì tôi trải nghiệm ở Việt Úc tôi không bao giờ quên được. Việt Úc đã mang lại cho tôi rất nhiều giá trị, rèn luyện cho tôi sự tự tin và một con người bản lĩnh, để có thể kiểm soát trong mọi tình huống"". Đó cũng là điều mà chị Huệ mong muốn cho con mình được trải nghiệm. Không chỉ chị và 2 con, em gái của chị Huệ cũng là một cựu học sinh của VAS. Có thể nói đây là một điều vô cùng hiếm gặp tại một ngôi trường quốc tế ở Việt Nam. VAS là ngôi trường quốc tế hiếm có tại TP.HCM với học sinh là hai thế hệ trong một gia đình cùng theo học Được truyền cảm hứng từ câu chuyện ""hai thế hệ học sinh trưởng thành tại VAS"" của chị gia đình chị Huệ, VAS mong muốn ngày càng nhiều gia đình Việt có được những trải nghiệm quý giá như gia đình chị. Đó chính là lý do VAS đã nghiên cứu và đưa vào giảng dạy một lộ trình học tập mới, mang tới cơ hội học tập trong môi trường giáo dục quốc tế cho đông đảo học sinh Việt, đồng thời hỗ trợ phụ huynh giải tỏa những lo lắng về rào cản học phí để hoàn thành giấc mơ của gia đình. Lộ trình Tiếng Anh Cambridge tiêu chuẩn (Lộ trình CEP Tiêu chuẩn - CEP Standard) được VAS nghiên cứu, xây dựng trong nhiều năm và chính thức đưa vào giảng dạy từ năm học 2023 - 2024. Lộ trình này đáp ứng nhu cầu của phụ huynh, học sinh về một chương trình học giúp học sinh trang bị đầy đủ kiến thức, nền tảng và kỹ năng cần thiết đáp ứng xu thế hội nhập toàn cầu, đồng thời vẫn giữ được những giá trị cốt lõi và bản sắc của văn hóa Việt Nam. Lộ trình CEP Tiêu chuẩn hướng đến việc hỗ trợ xây dựng một kế hoạch học tập dài hạn cho học sinh ở mức học phí phù hợp Với mức phí phù hợp với khả năng tài chính của nhiều gia đình, đặc biệt là tính linh hoạt của Lộ trình CEP Tiêu chuẩn, gia đình dễ dàng xây dựng một kế hoạch học tập dài hạn, xuyên suốt cho con và dễ dàng chuyển đổi sang các Lộ trình khác đang được triển khai song song tại VAS, tùy theo định hướng và kế hoạch tài chính của gia đình trong mỗi giai đoạn. Phụ huynh tìm hiểu chi tiết về Lộ trình CEP Tiêu chuẩn tại: www.vas.edu.vn VAS đang tuyển sinh Lộ trình CEP Tiêu chuẩn từ bậc Mầm non đến lớp 6 với nhiều ưu đãi hấp dẫn. - Học bổng đăng ký sớm lên đến 20.000.000 đồng - Miễn 100% Phí kiểm tra đầu vào - Giảm học phí trọn năm lên đến 5%. Để tham quan trực tiếp các cơ sở hoặc cần tư vấn, vui lòng liên hệ hotline: 0911.267755.",Giáo dục,Thanh Niên,2
5401,"Trường tiểu học Kim Giang tổ chức dã ngoại cho khối 3, 4, 5 nhân dịp ngày thành lập Đoàn Thanh niên Cộng sản Hồ Chí Minh.","TP - Tự đưa ra lí do doanh số bán ô tô sụt giảm mạnh, Hiệp hội Các nhà sản xuất ô tô Việt Nam (VAMA) và nhiều doanh nghiệp kiến nghị lùi thời gian nộp thuế tiêu thụ đặc biệt (TTĐB) năm 2023, giảm 50% lệ phí trước bạ với xe sản xuất, lắp ráp trong nước. Các chuyên gia cho rằng, cơ quan chức năng khi xem xét đề xuất này cần hài hoà lợi ích của doanh nghiệp và người dân. Nhằm kích cầu tiêu dùng, khuyến khích người dân mua sắm cũng như thúc đẩy doanh nghiệp sản xuất, lắp ráp trong nước sau những tác động của dịch COVID-19, lệ phí trước bạ với ô tô sản xuất lắp ráp trong nước giảm 50%. Thời gian giảm trong 6 tháng (từ 1/12/2021 đến hết 31/5/2022). Từ ngày 1/6/2022 trở đi, mức thu lệ phí trước bạ quay trở lại mức ban đầu.",KINH TẾ,Tiền Phong,2
49,"Đoàn y bác sĩ Quân y Bệnh viện 175 do bác sĩ Nguyễn Xuân Thành- Trưởng khoa tim mạch- hồi tháng 1-2023 đã tổ chức khám bệnh, cấp thuốc miễn phí và tặng quà tết cho 200 bà con hộ nghèo, gia đình chính sách tại phường An Phú Đông, quận 12, TP.HCM,","(PLO)- Đoàn bác sĩ Quân y Bệnh viện Quân y 175, UBND phường Tân Chánh Hiệp (quận 12, TP.HCM) và các nhà tài trợ đã tổ chức đã khám bệnh, siêu âm, chụp CT và cấp thuốc cho 250 hộ gia đình nghèo. Ngày 25-2, Đoàn bác sĩ Quân y Bệnh viện Quân y 175, UBND phường Tân Chánh Hiệp, quận 12, TP.HCM và các nhà tài trợ đã tổ chức đã khám bệnh, siêu âm, chụp CT và cấp thuốc cho 250 hộ gia đình chính sách, hộ nghèo, người có hoàn cảnh khó khăn tại phường Tân Chánh Hiệp, quận 12, TP.HCM. Chương trình cũng trao 200 suất quà cho người có hoàn cảnh khó khăn, mỗi phần quà gồm nhu yếu phẩm trị giá 400.000 đồng. Ngoài việc thăm khám bệnh, cấp thuốc và tặng quà tại trụ sở UBND phường, đội ngũ y bác sĩ quân y cũng đến tận nhà thăm khám bệnh cho 10 cụ cao tuổi đi lại khó khăn. Bà Nguyễn Thị Thời (71 tuổi) được các bác sĩ đến thăm khám bệnh tại nhà xúc động nói: “Tôi tuổi cao sức yếu, nhiều năm không đi lại được nay được các bác sĩ và cán bộ phường đến tận giường thăm hỏi gia cảnh, khám bệnh và tặng quà, tôi cảm thấy người già yếu được quan tâm, giúp đỡ lúc khó khăn. Mong chương trình tiếp tục chia sẻ đến những người có hoàn cảnh khó khăn như tôi"", bà Thời nêu tâm nguyện. Thượng tá, bác sĩ Nguyễn Xuân Thành, Trưởng Đoàn bác sĩ Quân y Bệnh viện Quân y 175, thông tin đây là hoạt động xã hội thường xuyên của đội ngũ y bác sĩ của Bệnh viện Quân y 175. Đợt này, đoàn các đồng hành cùng, đảng ủy, UBND, Ủy ban mặt trận tổ quốc phường Tân Chánh Hiệp, cùng các nhà tài trợ, nhà thuốc tổ chức khám và phát quà cho 250 hộ gia đình chính sách, người nghèo trên địa bàn phường. Đặc biệt, có 10 bệnh nhân do tuổi cao sức yếu, bệnh tình nặng đi lại khó khăn, đoàn đã cử hai bác sĩ và cán bộ phường đến khám, kê toa thuốc tại nhà. Kết quả ban đầu cho thấy phần lớn các cô bác do tuổi cao sức yếu bị bệnh xương khớp, tim mạch nên đi lại khó khăn. Sau đợt này, đoàn sẽ tiếp tục theo dõi tình hình sức khỏe của các cô chú để có sự tư vấn, hỗ trợ, điều trị bệnh tốt hơn. Cùng đoàn y bác sĩ về tận nhà khám bệnh cho bà con, ông Nguyễn Chí Thiện, Chủ tịch UBND phường Tân Chánh Hiệp, cho biết trên địa bàn phường vẫn còn nhiều cô bác có hoàn khó khăn, mang nhiều bệnh tình trong người. Lần này, phường phối hợp Đoàn y bác sĩ Bệnh viện Quân y 175, doanh nghiệp, nhà thuốc khám bệnh, phát thuốc và tặng quà cho bà con, bước đầu sàng lọc bệnh tật, tiếp đó sẽ có phương án hỗ trợ bà con bảo vệ sức khỏe tốt hơn. Trước đó, hồi tháng 1-2023, Đoàn y bác sĩ Quân y Bệnh viện 175 do bác sĩ Nguyễn Xuân Thành làm trưởng đoàn đã tổ chức Chương trình: “Chia sẻ khám bệnh, cấp thuốc miễn phí và tặng quà tết cho 200 bà con hộ nghèo, gia đình chính sách tại phường An Phú Đông, quận 12, TP.HCM. Một số hình ảnh tại chương trình khám bệnh, phát thuốc và tặng quà tại phường Tân Chánh Hiệp, quận 12, TP.HCM:",XÃ HỘI,Báo Pháp Luật HCM,2
4642,"Chủ tịch HĐQT Liên hiệp HTX Kinh tế số Việt Nam PGS.TS. Mai Quang Vinh, hiện đang trú tại Nha Trang giới thiệu giải pháp Egap và eGap.vn - quản lý điện tử 4.0 thực hành nông nghiệp tốt.","(Chinhphu.vn) - Việc phát triển tích hợp ứng dụng trí tuệ nhân tạo (AI) trong nông nghiệp đang ngày càng trở nên phổ biến, giúp nâng cao năng suất và hiệu quả sản xuất trong ngành nông nghiệp. Nhà kính, nhà lưới trong nông nghiệp có thể dùng công nghệ AI thu thập dữ liệu, sau đó bộ trung tâm giao tiếp truyền nhận trung gian xử lý dữ liệu - Ảnh minh họa Chia sẻ tại Hội thảo ""Ứng dụng công nghệ AI trong nâng cao năng suất nông nghiệp"" do Tổng hội Nông nghiệp và Phát triển nông thôn tổ chức ngày 23/3, ông Nguyễn Văn Trinh, Trung tâm R&D (Rạng Đông) cho biết, nhiều năm qua, Công ty CP bóng đèn phích nước Rạng Đông (Thanh Xuân, Hà Nội) đã có nhiều nghiên cứu, ứng dụng Giải pháp ánh sáng và điều khiển ứng dụng trong sản xuất nông nghiệp thông minh. Bên cạnh đó, Rạng Đông cũng đang ứng dụng công nghệ phổ ánh sáng đối với cây ăn quả, dược liệu, giúp nâng cao chất lượng, độ ngọt của cây… Giải pháp này giúp khắc phục được hạn chế của những nhà kính cũ trong nông nghiệp như thiếu thiết bị, chỉ có tác dụng che mưa, ngăn côn trùng; có thể điều chỉnh tự động ánh sáng, nhiệt độ, độ ẩm, tưới tiêu, dinh dưỡng… thông qua một sensors cảm biến nhà kính, nhà lưới thu thập dữ liệu, sau đó bộ trung tâm giao tiếp truyền nhận trung gian xử lý dữ liệu giữa tầng thiết bị và tầng cloud. Cũng đang ứng dụng trí tuệ nhân tạo (AI) trong sản xuất nông sản, PGS.TS. Mai Quang Vinh, Chủ tịch HĐQT Liên hiệp HTX Kinh tế số Việt Nam giới thiệu giải pháp Egap và eGap.vn - quản lý điện tử 4.0 thực hành nông nghiệp tốt. Theo đó, eGap.vn là Cổng thông tin quản lý, giám sát, truy xuất nguồn gốc cho 4 nhóm ngành hàng: Cây trồng, chăn nuôi, thủy sản, chế biến nông sản với nhật ký điện tử trên 2 nền tảng Android và iOS. Với ứng dụng này, thông qua nhật ký điện tử, camera đồng ruộng lưu trữ thông tin theo thời gian thực về toàn bộ chuỗi sản xuất, theo dõi giám sát được vùng trồng theo hợp đồng đã ký, đảm bảo được nguồn hàng ổn định, đúng tiêu chuẩn quy định, phát triển sản xuất – tiêu thụ bền vững, quản lý mã số quản lý tới tận hộ (tổ) sản xuất. Người sản xuất biết trước được sản phẩm của mình sẽ bán cho ai, giá cả, chủ động lập kế hoạch, hạch toán, minh bạch về thông tin đầu vào của vật tư (đúng quy định, chủng loại), chịu sự giám sát tuân thủ tiêu chuẩn, quy trình sản xuất của khách hàng. Khách hàng thông qua tem Qr-Code tìm hiểu thông tin minh bạch, có kiểm chứng, tạo niềm tin về sản phẩm. Tương tự, Công ty CP ICheck Việt Nam cũng giới thiệu hệ thống truy xuất nguồn gốc toàn diện được nghiên cứu và phát triển bởi hơn 50 kỹ sư trong vòng 5 năm nhằm giúp doanh nghiệp quản lý toàn diện vùng trồng, nhà xưởng, vùng sản xuất và thông tin truy xuất theo các chuỗi cung ứng, quá trình hình thành lên sản phẩm bao gồm: Vật tư, con giống, vùng trồng, vùng sản xuất, nhân viên; ghi lại nhật ký điện tử quá trình sản xuất, vận chuyển, phân phối… tới thành phẩm cuối cùng. Tại Việt Nam, ứng dụng AI vào nông nghiệp vẫn còn khá mới mẻ nhưng đang thu hút được sự quan tâm của Chính phủ cũng như của các doanh nghiệp sản xuất vì những ưu thế mà nó mang lại so với nông nghiệp truyền thống. Theo TS Nguyễn Quốc Toản, Giám đốc Trung tâm Chuyển đổi số và Thống kê Nông nghiệp (Bộ NN&PTNT), chuyển đổi số trong nông nghiệp đặt trong bối cảnh xu hướng số đang dịch chuyển nền kinh tế. Theo đó, ""vùng nông thôn sẽ là nhân tố thúc đẩy giai đoạn bùng nổ tiếp theo của nền kinh tế số"". Hiện, tỉ lệ sử dụng Internet ở nông thôn tăng đáng kể, có khoảng 77% người dân nông thôn kết nối Internet, trong đó có 91% lên mạng hằng ngày. Ngày nay, những loại thiết bị máy móc ứng dụng trí tuệ nhân tạo đang dần phổ biến trong thời đại công nghệ phát triển. Những loại máy này được sáng tạo và ứng dụng trong nhiều lĩnh vực đời sống, trong đó có cả sản xuất nông nghiệp. Trí tuệ nhân tạo giúp năng suất cây trồng được tăng lên, cây trồng được khỏe mạnh hơn, kiểm soát sâu bệnh và các điều kiện trồng trọt; tổ chức dữ liệu cho nông dân, giúp giải quyết khối lượng công việc và cải thiện một loạt các nhiệm vụ liên quan đến nông nghiệp trong toàn bộ chuỗi cung ứng thực phẩm. Những tiến bộ trong chế tạo robot điều khiển bằng AI cũng đang giúp nhà nông trong việc tăng gia sản xuất sử dụng ít đất và ít nhân công hơn. Ông Hồ Xuân Hùng, Chủ tịch Tổng hội NN&PTNT Việt Nam cho biết, Tổng hội sẽ giúp kết nối và thu hút các nhà doanh nghiệp, nhà đầu tư, nhà khoa học và nhà nông nhằm góp phần đẩy mạnh chuyển đổi số ứng dụng trí tuệ nhân tạo trong nông nghiệp, tạo hiệu quả cao trong sản xuất nông nghiệp. Trên cơ sở nhận thức đầy đủ, thay đổi tư duy, kịp thời có kế hoạch cụ thể thúc đẩy và phát triển các ứng dụng trí tuệ nhân tạo trong lĩnh vực sản xuất nông nghiệp, ứng dụng công nghệ cao, nhằm thông minh hóa, tự động hóa quy trình sản xuất, nâng cao năng suất chất lượng sản phẩm nông nghiệp, đảm bảo quy trình sản xuất, xuất xứ minh bạch, cung cấp thực phẩm sạch cho người tiêu dùng. TS. Trần Quý, Viện trưởng Viện Phát triển kinh tế số Việt Nam cho rằng, để áp dụng thành công các công nghệ mới, như AI trong nông nghiệp, nông dân Việt Nam cần được đào tạo để sử dụng và hiểu rõ các công nghệ này. Điều này đặc biệt quan trọng vì nông nghiệp Việt Nam đang phải đối mặt với nhiều thách thức, bao gồm thay đổi khí hậu, giá cả nguyên liệu tăng cao và cạnh tranh trong thị trường toàn cầu. ""Ngoài ra, để đảm bảo rằng nông dân có thể tiếp cận được các công nghệ mới, cần có sự hỗ trợ về tài chính và công nghệ từ Chính phủ, các tổ chức quốc tế và các công ty trong lĩnh vực nông nghiệp. Sự hỗ trợ này có thể bao gồm các khoản tài trợ để đầu tư vào các hệ thống AI và robot tự động hóa, các dịch vụ tư vấn và hỗ trợ kỹ thuật để giúp các nông dân sử dụng các công nghệ mới"", ông Quý nói. Đỗ Hương",Khoa giáo,Chính Phủ,2
3838,"Phải thi đấu ở trên sân khách Nepal, Đội tuyển nữ Việt Nam gặp khó khăn về giao tiếp trong trận đấu với Nepal.","(Chinhphu.vn) - Trong trận ra quân vòng loại thứ nhất bóng đá nữ Olympic 2024, Đội tuyển nữ Việt Nam đã thắng đội chủ nhà Nepal với tỉ số 5-1. Dù vậy, HLV Mai Đức Chung vẫn chưa hài lòng về kết quả này. Các cầu thủ Việt Nam ăn mừng bàn thắng - Ảnh: VFF Trận đấu lượt đi vòng loại thứ nhất bóng đá nữ Olympic 2024 bảng C giữa Đội tuyển (ĐT) nữ Việt Nam và ĐT nữ Nepal diễn ra trên SVĐ Dashrath thủ đô Kathmandu (Nepal) vào tối 5/4. Được đánh giá cao hơn hẳn so với chủ nhà Nepal (hạng 100 FIFA), ĐT nữ Việt Nam (hạng 33 FIFA) sớm tạo ra ưu thế về tỉ số với bàn thắng ở phút thứ 11 từ pha đánh đầu của Hải Yến. Tiếp tục gây sức ép, đến phút 36, ĐT nữ Việt Nam nâng tỉ số lên 2-0 sau khi Đội trưởng Huỳnh Như thực hiện thành công quả phạt đền. Hai phút sau, bàn thắng thứ 3 của các học trò Mai Đức Chung ghi được vào phút 38 do công của Bích Thùy. Sang hiệp 2, phút 48, đón đường tạt từ cánh trái, Huỳnh Như bật cao đánh đầu, đưa bóng vào góc xa, ghi bàn thắng thứ 4 cho ĐT nữ Việt Nam. Đây cũng là bàn thắng thứ 2 của Huỳnh Như, người đang chơi bóng tại Bồ Đào Nha, ở trận đấu này. Mộ số hình ảnh trong trận đấu giữa ĐT nữ Việt Nam (áo trắng) và ĐT nữ Nepal - Nguồn: AFC/VFF Bị dẫn trước 4 bàn, đội chủ nhà cũng đã nỗ lực để ghi bàn rút ngắn tỉ số xuống còn 1-4 vào phút 79. Tuy nhiên, đến phút 90 của trận đấu, ĐT nữ Việt Nam ghi được bàn thắng thứ 5. Bàn thắng này do Thanh Nhã ghi từ cự ly cách cầu môn Nepal gần 30 m. Thắng chung cuộc 5-1 trận lượt đi, các học trò HLV Mai Đức Chung gần như cầm chắc tấm vé vào vòng 2 trước trận lượt về vào ngày 8/4. Phát biểu về kết quả trận đấu, HLV Mai Đức Chung cho biết ĐT nữ Việt Nam đã giành chiến thắng khá đậm nhưng vẫn còn một số tình huống phối hợp chưa tốt. Theo ông Mai Đức Chung, ĐT nữ Nepal (hạng 100 FIFA) đã tiến bộ vượt bậc và có thủ môn chơi xuất sắc nên chỉ phải nhận 5 bàn thua ở trận đấu này. HLV Mai Đức Chung vẫn chưa hài lòng dù các học trò thắng Nepal 5-1- Ảnh: VFF Về nguyên nhân khiến các học trò chưa thi đấu thực sự tốt, ông Mai Đức Chung cho biết thêm ĐT nữ Việt Nam chưa quen sân bóng. Mặt sân hơi cứng nên những đường chuyền còn thiếu chính xác. Bên cạnh đó, do Nepal có độ cao so với mực nước biển cao hơn Việt Nam (độ cao trung bình hơn 3.000 m; Nepal sở hữu 8/14 ngọn núi cao nhất thế giới từ 8.000 m trở lên, đều thuộc dãy Himalaya, trong đó có đỉnh Everest) nên không khí loãng. Do mới chỉ đến đây 2 ngày (ngày 3/4) nên toàn đội chưa hoàn toàn thích nghi. Ở trận lượt về (ngày 8/4), nếu không thua Nepal từ 5 bàn cách biệt trở lên, các học trò HLV Mai Đức Chung sẽ giành vé vào vòng 2 bóng đá nữ Olympic 2024. Theo kế hoạch, sau khi kết thúc vòng loại thứ nhất Olympic Paris 2024, ĐT nữ Việt Nam sẽ sang Nhật Bản tập huấn trước khi bước vào hành trình bảo vệ ngôi hậu tại đấu trường SEA Games 32./. Thanh Xuân",Văn hoá,Chính Phủ,2
