index,claim,context,topic,author,labels
4925,"U23 Kyrgyzstan đã bị thua 3-0 bởi U23 Việt Nam trong trận giao hữu tại Dubai ngay dưới thời HLV Park Hang Seo. Trong trận đấu đó, bàn mở tỉ số từ chấm 11m đã được ghi bởi Lê Văn Đô, và bàn thắng được ghi bởi Trần Văn Đạt sau đó đã được kiến tạo bởi anh. Tuy nhiên, U23 Việt Nam đã thua U23 Iraq 0-3 và U23 UAE 0-4 sau đó, gây ra nhiều chỉ trích từ người hâm mộ.","Thất bại ở Doha Cup 2023 là điều bình thường với U23 Việt Nam khi các đối thủ đều mạnh. HLV Troussier (giữa) và các học trò tập luyện trước trận gặp U23 Kyrgyzstan - Ảnh: VFF Nhưng một kết quả tốt của thầy trò HLV Philippe Troussier trước U23 Kyrygzstan ở trận cuối vào 0h30 sáng 29-3 (FPT Play THTT) sẽ ít nhiều đem đến niềm tin cho người hâm mộ ở tương lai. U23 Kyrgyzstan không phải là đối thủ quá chênh lệch với U23 Việt Nam. Dưới thời HLV Park Hang Seo, U23 Việt Nam từng thắng U23 Kyrgyzstan 3-0 trong trận giao hữu tại Dubai trước khi tham dự vòng loại U23 châu Á 2022. Khi đó, Lê Văn Đô - người hiện đang khoác áo U23 thời HLV Philippe Troussier - là người ghi bàn mở tỉ số trên chấm 11m và sau đó kiến tạo cho Trần Văn Đạt ghi bàn ấn định chiến thắng 3-0. Hai trận thua đậm 0-3 trước U23 Iraq và 0-4 trước U23 UAE đã khiến U23 Việt Nam nhận không ít chỉ trích từ người hâm mộ. Không chỉ là về mặt tỉ số, lối chơi kiểm soát bóng không hiệu quả của U23 Việt Nam là điều khiến người hâm mộ bắt đầu ""lung lay"" niềm tin. Đặc biệt là khi nhìn ""kình địch"" U23 Thái Lan cầm hòa U23 Saudi Arabia 2-2, thắng chủ nhà U23 Qatar 1-0 để vào tranh hạng 3 cùng U23 Kuwait. Công bằng mà nói, các cầu thủ U23 Việt Nam chỉ có chưa đầy một tháng tập luyện với triết lý bóng đá mới nên chưa thể vận dụng linh hoạt những gì mà HLV Troussier truyền đạt. Nhiều cầu thủ thời gian qua do không được thi đấu ở CLB nên cảm giác bóng chưa tốt. Vì thế, khi đối đầu với những đối thủ mạnh của châu lục, họ không thể triển khai bóng như mong muốn và chuyền hỏng khá nhiều. Muốn giành kết quả tốt trước đối thủ vừa tầm như U23 Kyrgyzstan, U23 Việt Nam cần phải sửa chữa những sai lầm cá nhân, sự vội vàng trong xử lý bóng và hoàn thiện hơn nữa lối chơi nhằm có thể ghi bàn thắng đầu tiên tại Doha Cup 2023. Hai trận thua trước U23 Kuwait 0-1 và U23 Oman 0-2 cho thấy sai lầm của U23 Kyrgyzstan ở hàng thủ để U23 Việt Nam khai thác. HLV Troussier đã có nhiều thử nghiệm nhân sự lẫn vị trí thi đấu trong hai trận đầu tiên ở Doha Cup 2023. Vì vậy, giới chuyên môn đang chờ xem ông sẽ tiếp tục thử nghiệm hay bố trí đội hình gần như mạnh nhất của U23 Việt Nam cho trận đấu mang nhiều ý nghĩa với U23 Kyrgyzstan. Nói vậy, bởi thêm một trận thua trước đối thủ không quá mạnh, làn sóng chỉ trích sẽ lại càng nhiều thêm với U23 Việt Nam trong hành trình chuẩn bị cho SEA Games 32. Dù thủng lưới đến 7 bàn sau hai trận, nhưng hàng thủ là nơi HLV Troussier sẽ ít có những thử nghiệm hay thay đổi. Quan Văn Chuẩn là thủ môn số 1. Bộ ba trung vệ sẽ là Tuấn Tài, Tiến Long, Duy Cương. Ở tuyến giữa, Công Đến cũng xem như chắc suất vị trí tiền vệ trung tâm. Những vị trí còn lại, tùy từng đối thủ khác nhau, ông Troussier sẽ bố trí cho phù hợp. Nhưng có thể thấy, tam giác tấn công lợi hại của U20 Việt Nam ở VCK U20 châu Á 2023 vừa qua là Văn Khang, Văn Trường, Quốc Việt vẫn chưa thể hiện được như kỳ vọng. Trận gặp U23 Kyrgyzstan là dịp để các cầu thủ trẻ này thể hiện năng lực. Không đặt nặng thắng thua, nhưng HLV Troussier vẫn kỳ vọng vào việc các học trò sẽ thi đấu tốt trong trận tranh hạng 9 với U23 Kyrgyzstan. ""Ở trận đầu tiên, chúng ta đã chơi tốt trong khoảng 20 phút đầu trước khi bị thiếu người vì thẻ đỏ. Ở trận thứ hai, chúng ta đã chơi rất tốt trong 45 phút của hiệp một. Ở trận thứ ba, chúng ta sẽ phải cố gắng để chơi tốt trong ít nhất 60 -70 phút. Chúng ta sẽ cải thiện từng bước, từng bước..."", ông Troussier nói.).",Thể thao,Tuổi Trẻ,0
4332,"Theo luật Hoàng gia Anh, cháu của quân chủ sẽ có thể được gọi là hoàng tử hoặc công chúa, như vậy các con của hoàng tử Harry, là cháu nội của Vua Charles III, bao gồm Archie (3 tuổi) và Lilibet (1 tuổi), đủ điều kiện để nhận các tước vị khi ông nội đã trở thành vua vào tháng 9-2022.","Ngày 8-3, Harry và Meghan ra thông báo về việc Archie và Lilibet sẽ có tước vị hoàng gia. Cặp đôi Harry - Meghan và con gái Lilibet - Ảnh: GETTY IMAGES Theo báo SCMP, các con của Harry và Meghan sẽ có tước vị là hoàng tử và công chúa. Cặp đôi lần đầu tiên công khai sử dụng tước vị cho các con nhân dịp thông báo về việc rửa tội của công chúa Lilibet Diana, con gái út của hai người. Theo luật Hoàng gia Anh, cháu của quân chủ sẽ có thể được gọi là hoàng tử hoặc công chúa, như vậy các con của hoàng tử Harry, là cháu nội của Vua Charles III, bao gồm Archie (3 tuổi) và Lilibet (1 tuổi), đủ điều kiện để nhận các tước vị khi ông nội đã trở thành vua vào tháng 9-2022. Việc các con của Harry và Meghan sẽ có tước vị hoàng gia không được dự đoán trước cho đến khi cặp đôi dùng tước vị trong thông báo về việc rửa tội của công chúa Lilibet hôm 8-3. ""Tôi xác nhận công chúa Lilibet đã được rửa tội vào ngày 8-3 bởi Đức giám mục Los Angeles, cha John Taylor"", người phát ngôn của cặp đôi ra thông báo hôm 8-3. Điện Buckingham nói sẽ cập nhật các tước vị của Archie và Lilibet lên website khi đến ""thời điểm thích hợp"". Các con của Harry có được nhận hoặc sẽ tiếp nhận tước vị hoàng gia là chủ đề được bàn tán vì mối quan hệ được cho là không mấy tốt đẹp giữa cặp đôi và vua cha. Trong một buổi phỏng vấn vào năm 2020, Meghan cho biết Hoàng gia Anh đã từ chối trao tước vị hoàng tử cho con trai cô là Archie và đã bàn tán về việc cậu bé sẽ có da màu. Đầu năm 2023, Harry đã cho xuất bản cuốn hồi ký Spare kể lại những ký ức không tốt đẹp của anh với gia đình Hoàng gia Anh. Harry và Meghan cũng gây tranh cãi khi sản xuất series phim tài liệu Harry and Meghan chiếu trên Netflix, phơi bày nhiều mâu thuẫn và bí mật gia đình. Ngày 1-3, tờ The Sun đưa tin, Vua Charles đã quyết định đuổi vợ chồng Harry và Meghan Markle khỏi nơi ở hoàng gia của họ tại Frogmore Cottage, thông tin này hiện đã được Hoàng gia Anh xác nhận. Việc thừa kế tước vị đang được Hoàng gia Anh làm theo tiền lệ ra đời vào năm 1917 thời Vua George V. Trong đó, các tước vị hoàng tử và công chúa sẽ được trao cho các cháu là con của con trai quân chủ. Hiện chưa rõ hoàng tử Harry có tham dự lễ đăng quang của cha là Vua Charles III vào tháng 5 sắp tới.",Giải trí,Tuổi Trẻ,0
2624,Hãng tin Reuters dẫn nguồn thạo tin ngày 28-3-2023 (giờ Mỹ) cho biết ông Mike Pence được yêu cầu làm chứng về những đoạn hội thoại với cựu tổng thống Donald Trump trong giai đoạn trước ngày 6-1-2021.,"Một thẩm phán liên bang Mỹ yêu cầu cựu phó tổng thống Mike Pence ra làm chứng trước đại bồi thẩm đoàn liên quan đến vụ bạo loạn tại tòa nhà Quốc hội Mỹ vào ngày 6-1-2021. Cựu phó tổng thống Mike Pence phát biểu tại Hội nghị Quỹ Tổng thống Coolidge hôm 16-2, trong đó phản đối trát hầu tòa của mình - Ảnh: REUTERS Hãng tin Reuters dẫn nguồn thạo tin ngày 28-3 (giờ Mỹ) cho biết ông Mike Pence được yêu cầu làm chứng về những đoạn hội thoại với cựu tổng thống Donald Trump trong giai đoạn trước ngày 6-1-2021. Tuy nhiên, ông Pence sẽ có quyền từ chối trả lời những câu hỏi liên quan đến vai trò của ông tại Quốc hội Mỹ vào ngày xảy ra vụ bạo loạn. Hiến pháp Mỹ quy định các thượng nghị sĩ hoặc dân biểu sẽ luôn được miễn chất vấn về bất kỳ lời nói hoặc cuộc tranh luận nào được thực hiện tại viện của mình, trừ trường hợp phản quốc, tội phạm đặc biệt nghiêm trọng hoặc chống lại hòa bình. Cả ông Trump và ông Pence - người cũng đang cân nhắc việc tranh cử tổng thống Mỹ năm 2024 - đều muốn tránh để cựu phó tổng thống Pence phải làm chứng trước tòa. Đến nay, ông Pence là một trong những nhân chứng quan trọng cuối cùng kháng cự việc này. Theo đó, ông Trump viện dẫn quyền hành pháp quy định các trao đổi giữa tổng thống với các thành viên chính phủ thân cận được phép không bị tiết lộ. Luật sư của ông Pence thì cho rằng hiến pháp bảo vệ thành viên Quốc hội khỏi việc cung cấp bằng chứng trước tòa. Trước đây ông Pence là phó tổng thống Mỹ và cũng đảm nhận vai trò chủ tịch Thượng viện. Ông Pence nói thêm: ""Tuy nhiên, cách họ thực hiện điều đó và những yêu cầu cho việc làm chứng của tôi vẫn đang được chúng tôi xem xét. Tôi sẽ chia sẻ thêm trong vài ngày tới"". Phán quyết của tòa xuất phát từ việc ông Trump đã liên tục thúc ép cấp phó của mình dùng tư cách giám sát công tác kiểm phiếu bầu của Quốc hội - một vai trò vốn chỉ mang tính hình thức - để chặn đứng, hoặc ít nhất trì hoãn việc xác nhận chiến thắng của ông Joe Biden. Ông Pence đã từ chối đề nghị này.",Thế giới,Tuổi Trẻ,0
2361,"Đảo Trindade là một hòn đảo núi lửa xa xôi ngoài khơi bờ biển Brazil, chỉ có thể đến được bằng hành trình đi thuyền từ 3 đến 4 ngày.","Phát hiện mới trên đảo Trindade của Brazil làm dấy lên lo ngại rằng ô nhiễm rác thải nhựa đang tạo ra một dạng hình thành địa chất mới. Có rất ít nơi trên Trái Đất bị cô lập như Trindade, một hòn đảo núi lửa ngoài ở khơi bờ biển Brazil mà phải đi thuyền 3 đến 4 ngày mới có thể tiếp cận. Vì vậy, nhà địa chất học Fernanda Avelar Santos - Giáo sư tại Đại học Liên bang Parana ở miền nam Brazil - đã giật mình khi nhận ra một dấu hiệu đáng lo ngại về tác động của con người đối với cảnh quan hoang sơ tại đây: những tảng đá được hình thành từ rác thải nhựa trôi nổi trong đại dương, AFP hôm 21/3 đưa tin. Santos lần đầu tiên tìm thấy ""đá nhựa"" vào năm 2019, khi cô đến đảo để nghiên cứu luận án tiến sĩ về một chủ đề hoàn toàn khác: sạt lở đất và xói mòn. Trong lúc làm việc gần một khu bảo tồn thiên nhiên được bảo vệ có tên là Bãi biển Rùa, nơi sinh sản lớn nhất thế giới của loài đồi mồi dứa có nguy cơ tuyệt chủng, Santos bắt gặp một tảng đá lớn màu xanh lục trông rất kỳ lạ. Kết thúc chuyến thám hiểm kéo dài hai tháng, cô mang một số mẫu vật về phòng thí nghiệm của mình và sau khi phân tích, Santos cùng các cộng sự đã xác định chúng là một dạng hình thành địa chất mới, hợp nhất từ các vật liệu và quá trình mà Trái Đất sử dụng để hình thành đá trong hàng tỷ năm với một thành phần mới: rác thải nhựa. ""Chúng tôi kết luận rằng con người đang đóng vai trò là một tác nhân địa chất, ảnh hưởng đến các quá trình mà trước đây là hoàn toàn tự nhiên, chẳng hạn như sự hình thành đá"", Santos nói với AFP. ""Nó phù hợp với ý tưởng về Anthropocene hay thế Nhân tân mà các nhà khoa học nói đến rất nhiều ngày nay, một kỷ nguyên địa chất mới khi con người ảnh hưởng đến các quá trình tự nhiên của hành tinh. Loại nhựa giống như đá này sẽ được lưu giữ trong hồ sơ địa chất và đánh dấu Anthropocene"". Phát hiện này khiến nhà nghiên cứu băn khoăn và buồn bã. Cô mô tả Trindade giống như thiên đường: một hòn đảo nhiệt đới xinh đẹp và sự cô lập của nó đã trở thành nơi ẩn náu cho đủ loài chim biển, các loài cá đặc hữu, cua gần như tuyệt chủng và đồi mồi dứa. Sự hiện diện duy nhất của con người trên hòn đảo ở Nam Đại Tây Dương này là một căn cứ quân sự nhỏ của Brazil và một trung tâm nghiên cứu khoa học. ""Vì vậy, thật đáng buồn khi tìm thấy những thứ như thế này trên một trong những bãi biển quan trọng nhất về mặt sinh thái"", Santos nói thêm. Cô trở lại đảo vào cuối năm ngoái để thu thập thêm mẫu vật và tìm hiểu sâu hơn về hiện tượng này. Nhà nghiên cứu lo sợ rằng khi đá nhựa bị xói mòn, vi nhựa sẽ rò rỉ vào môi trường và làm ô nhiễm thêm chuỗi thức ăn của hòn đảo. Trong bài đăng trên tạp chí Marine Pollution Bulletin, Santos cùng các cộng sự đã phân loại loại đá nhựa thành nhiều loại: prestiglomerate (tương tự đá trầm tích), pyroplastic (tương tự đá vụn) và đá dẻo (tương tự đá núi lửa hình thành từ dung nham). ""Ô nhiễm biển đang làm thay đổi mô hình của các khái niệm về sự hình thành trầm tích và đá,"" nhóm nghiên cứu viết trong báo cáo. ""Sự can thiệp của con người hiện nay phổ biến đến mức chúng ta phải đặt câu hỏi điều gì mới thực sự là tự nhiên"". Thành phần chính trong những tảng đá mà Santos phát hiện là tàn tích từ lưới đánh cá. Tuy nhiên, các dòng hải lưu cũng cuốn theo rất nhiều chai lọ, rác thải sinh hoạt và các loại nhựa khác từ khắp nơi trên thế giới đến hòn đảo này. ""Trindade là nơi nguyên sơ nhất mà tôi biết. Việc nhìn thấy mức độ dễ bị tổn thương của nó cho thấy vấn đề ô nhiễm đại dương do rác thải nhựa phổ biến trên toàn thế giới như thế nào"", nhà nghiên cứu nhấn mạnh. Đoàn Dương (Theo AFP)",Khoa học,VnExpress,0
1376,Một trong những yếu tố khiến cổ phiếu Novaland tăng vọt sau khi trải qua chuỗi giảm mạnh là thông tin 7 tờ trình cổ đông đều được thông qua.,"NVL tăng hết biên độ lên 11.900 đồng và khớp lệnh hơn 30 triệu cổ phiếu sau thông tin cổ đông đã thông qua tờ trình tăng vốn tối thiểu 29.000 tỷ đồng. Cổ phiếu của Tập đoàn Đầu tư địa ốc No Va (Novaland) giảm nhẹ khi mở cửa phiên giao dịch cuối tuần, nhưng càng về cuối phiên càng thể hiện sự hưng phấn. NVL chốt phiên tại giá trần, qua đó nối dài mạch đi lên phiên thứ ba liên tiếp. Lần gần nhất cổ phiếu này là phiên 6/3, sau khi trải qua một chuỗi giảm mạnh. Một trong những yếu tố giúp giá tăng vọt là thông tin toàn bộ 7 tờ trình cổ đông đều được thông qua, trong đó có nội dung phát hành 975 triệu cổ phiếu riêng lẻ cho nhà đầu tư chiến lược và chào bán 1,95 tỷ cổ phiếu cho cổ đông hiện hữu, được phát ra sáng nay. Ngoài ra, doanh nghiệp này cũng vừa thông báo đã có 2 người được đề cử vào Hội đồng quản trị là bà Đỗ Thị Phương Lan và ông Nguyễn Trần Đăng Phước. Khối lượng khớp lệnh Novaland cũng đạt mức cao nhất trong hơn một tháng trở lại đây. Nhờ đó, cổ phiếu này nằm trong danh sách 5 mã tác động tích cực nhất đến VN-Index. Ngoài Novaland, nhiều cổ phiếu bất động sản cũng đảo chiều từ giảm thành tăng trong phiên cuối tuần. NLG chạm trần, còn PDR, SCR, HQC, VHM, DIG đều tăng hơn 2% so với tham chiếu. Sắc xanh đồng thuận từ nhóm bất động sản giúp VN-Index nối dài chuỗi tăng 4 phiên liên tiếp, dù biên độ ngày càng hẹp dần. Chỉ số chốt phiên hôm nay sát mốc 1.047 điểm, tích luỹ chưa đến 2 điểm so với tham chiếu. Thanh khoản toàn thị trường đạt hơn 9.400 tỷ đồng, tăng gần 2.000 tỷ đồng so với hôm qua. Ngoài bất động sản thì dòng tiền tiếp tục đổ vào tài chính – ngân hàng với hơn 3.400 tỷ đồng. VND, VPB, STB là 3 mã hút tiền mạnh nhất khi giá trị giao dịch đều trên 400 tỷ đồng. Trong bối cảnh thị trường có tín hiệu ấm lên, khối ngoại tiếp tục giải ngân. Nhà đầu tư nước ngoài hôm nay mua vào gần 1.500 tỷ đồng và bán ra 1.375 tỷ đồng. VHM được giải ngân mạnh nhất với giá trị ròng hơn 70 tỷ đồng, trong khi đó MSN là cổ phiếu chịu áp lực xả hàng nhiều nhất với gần 50 tỷ đồng. Phương Đông",Kinh doanh,VnExpress,0
6626,Năm Du lịch Quốc gia 2023 đã khai mạc trong tối 25/3/2023 tại Novaworld Phan Thiết.,"Tỉnh Bình Thuận năm nay sẽ là điểm đến của hàng chục sự kiện với chủ đề ""Bình Thuận - Hội tụ xanh"". Tối 25/3, Năm Du lịch Quốc gia 2023 đã khai mạc tại Novaworld Phan Thiết. Ông Đoàn Anh Dũng, Chủ tịch UBND tỉnh Bình Thuận, cho biết sẽ có hơn 200 hoạt động, sự kiện văn hóa, thể thao, du lịch tầm cỡ quốc gia và quốc tế, diễn ra xuyên suốt năm trên địa bàn tỉnh và 41 tỉnh, thành phố cả nước. Theo đó, 13 hoạt động tầm quốc gia do Bộ Văn hóa, Thể thao và Du lịch cùng các Bộ, ban, ngành tổ chức gồm Festival nhiếp ảnh quốc tế, Triển lãm di sản văn hóa biển đảo, giải vô địch billiards và snooker quốc gia, triển lãm văn hóa và du lịch Việt Nam... Tỉnh Bình Thuận chủ trì 31 sự kiện gồm các lễ hội ẩm thực, trại hè, tuần lễ văn hóa đường phố, liên hoan các ban nhạc quốc tế, giải golf vô địch quốc gia, giải sailing và SUP, đua xe đạp, rowing và canoeing... Ngoài ra, còn có 164 sự kiện và hoạt động khác do 41 tỉnh, thành phố trên toàn quốc tổ chức. Các sự kiện nhằm giới thiệu, quảng bá giá trị văn hóa vật thể, phi vật thể và sản phẩm du lịch đặc sắc của Việt Nam, đồng thời lan tỏa thông điệp về một Bình Thuận phát triển xanh, bền vững, thân thiện với môi trường. Phó thủ tướng Trần Lưu Quang cho biết, năm Du lịch Quốc gia là chuỗi sự kiện văn hóa - kinh tế - xã hội và du lịch quy mô quốc gia và tầm quốc tế, được luân phiên tổ chức giữa các tỉnh thành từ năm 2003. Với chủ đề ""Bình Thuận - Hội tụ xanh"", tỉnh sẽ không chỉ phát triển du lịch đơn thuần, mà xa hơn là phát triển du lịch xanh, bền vững. ""Bình Thuận sẽ biến bất lợi về thời tiết thiên nhiên khô hạn, nắng gió thành thương hiệu riêng ""Biển xanh - Cát trắng - Nắng vàng"" trong suốt chiều dài phát triển"", Phó thủ tướng nói. Theo Sở Văn hóa, Thể thao và Du lịch Bình Thuận, năm 2022 toàn tỉnh đã đón trên 5,7 triệu lượt khách, trong đó có 75.500 lượt khách quốc tế, doanh thu du lịch 13.680 tỷ đồng. Hai tháng đầu năm nay tỉnh đón gần 1,38 triệu khách nội địa, trên 40.000 khách quốc tế, doanh thu ước đạt trên 3.563 tỷ đồng, dự kiến thu hút hơn 6,7 triệu du khách trong cả năm. Bình Thuận có nhiều thắng cảnh tự nhiên, bãi biển, cồn cát đẹp chạy dọc theo 192 km chiều dài bờ biển và nhiều đảo lớn nhỏ hoang sơ trong vùng lãnh hải rộng 52.000 km2. Ngoài ra tỉnh còn có nhiều di tích văn hóa, lịch sử, lễ hội dân gian, nghệ thuật ẩm thực đặc trưng. Bình Thuận, nhất là Mũi Né - Phan Thiết, hiện có nhiều dự án du lịch, khu phức hợp nghỉ dưỡng được quy hoạch đồng bộ, hiện đại, tích hợp đầy đủ tiện ích cao cấp. Những resort, bãi tắm đẹp, gần gũi với thiên nhiên, được nhiều tạp chí bình chọn là điểm đến hấp dẫn hàng đầu của Việt Nam và khu vực. Việt Quốc",Du lịch,VnExpress,0
1779,"Cả bốn model thuộc dòng iPhone 15 năm nay sẽ được trang bị Dynamic Island với thiết kế hình viên thuốc, theo nhà phân tích Ming-chi Kuo cho hay.","Phần khuyết Dynamic Island trên iPhone 15 được cho là sẽ tích hợp cả cảm biến tiệm cận mới, thay vì nằm bên dưới như trước. Theo nhà phân tích Ming-chi Kuo, cả bốn model thuộc dòng iPhone 15 năm nay sẽ được trang bị Dynamic Island với thiết kế hình viên thuốc. Apple cũng thực hiện nâng cấp quan trọng là chuyển cảm biến tiệm cận, vốn được đặt phía dưới Dynamic Island trên iPhone 14 Pro và 14 Pro Max, vào bên trong nó. Cảm biến này có nhiệm vụ tắt màn hình khi người dùng gọi điện thoại và đặt máy sát tai. Theo ông Kuo, điều chỉnh này có thể giúp Apple giảm chi phí sản xuất. Ngoài ra, hãng cũng sẽ chuyển sang sử dụng cảm biến với bước sóng 940 nm thay cho 1.380 nm trên ‌dòng 14 Pro‌. Bước sóng ngắn hơn không có nghĩa cảm biến tiệm cận mới kém hơn, mà sẽ đem lại lợi thế về hiệu suất so với thế hệ trước. Việc nâng cấp sẽ diễn ra trên cả bốn model, nhưng các tính năng hiển thị khác như màn hình Always On Display và ProMotion vẫn sẽ chỉ dành riêng cho dòng Pro. Ngoài ra, theo thông tin từ TrendForce, thế hệ iPhone 15 sẽ tăng dung lượng và thông số kỹ thuật của RAM lên 8 GB bằng đối thủ Android. Nâng cấp RAM giúp thiết bị hoạt động đa nhiệm tốt hơn khi có thể mở nhiều ứng dụng chạy nền cùng lúc hơn. iPhone 2023 dự kiến gồm iPhone 15, 15 Plus, 15 Pro và 15 Pro Max. Apple thường công bố điện thoại thế hệ mới vào tháng 9. Tuy nhiên, phụ thuộc vào chuỗi cung ứng, các model có thể được bán cùng lúc hoặc cách nhau vài tuần. Huy Đức",Số hóa,VnExpress,0
